,Question,orig_Question,Numbers,Equation,Answer,group_nums,Grade,Type,Body,Ques_Statement
677, mike number0 action figures he to . each shelf his room can number1 figures how many shelves he ?,mike has number0 action figures he wants to display . if each shelf in his room can hold number1 figures how many shelves does he need ?,64 8,/ number0 number1,8.0,"[1, 2, 3, 4, 7, 11, 17, 18, 19, 23, 24, 25]",4,Common-Division,mike has number0 action figures he wants to display . if each shelf in his room can hold number1 figures,how many shelves does he need ?
678, a group number0 friends pirates halloween . each costume cost number1 dollars how much they ?,a group of number0 friends were dressing as pirates for halloween . if each costume cost number1 dollars how much did they spend ?,8 5,* number0 number1,40.0,"[2, 3, 4, 13, 15, 16, 17, 20, 21, 22]",4,Multiplication,a group of number0 friends were dressing as pirates for halloween . if each costume cost number1 dollars,how much did they spend ?
679, an industrial machine number0 shirts . it can number1 shirts a minute . how many minutes the machine ?,an industrial machine made number0 shirts . it can make number1 shirts a minute . how many minutes was the machine working ?,12 2,/ number0 number1,6.0,"[2, 3, 4, 5, 9, 10, 11, 19, 20, 21]",4,Common-Division,an industrial machine made number0 shirts . it can make number1 shirts a minute .,how many minutes was the machine working ?
680, olivia 's dad her and some friends out to her birthday . each meal number0 dollars and her dad number1 meals how much he ?,olivia 's dad took her and some friends out to eat for her birthday . if each meal costs number0 dollars and her dad paid for number1 meals how much did he spend ?,7 3,* number0 number1,21.0,"[32, 3, 16, 18, 19, 20, 25, 26, 27, 30, 31]",4,Multiplication,olivia 's dad took her and some friends out to eat for her birthday . if each meal costs number0 dollars and her dad paid for number1 meals,how much did he spend ?
681, basketball team a number0 points . each person number1 points how many people ?,while playing basketball team a scored number0 points . if each person scored number1 points how many people were playing ?,18 2,/ number0 number1,9.0,"[1, 3, 5, 6, 7, 10, 12, 13, 14, 17, 18, 19]",4,Common-Division,while playing basketball team a scored number0 points . if each person scored number1 points,how many people were playing ?
682, katie number0 math problems homework . she number1 them the bus ride how many more she to ?,katie had number0 math problems for homework . if she finished number1 of them on the bus ride home how many more did she have to do ?,9 5,- number0 number1,4.0,"[1, 2, 3, 4, 10, 11, 12, 24, 25, 26]",4,Subtraction,katie had number0 math problems for homework . if she finished number1 of them on the bus ride home,how many more did she have to do ?
683, frank his family number0 pieces chicken dinner . they only number1 how many pieces he ?,frank bought his family number0 pieces of chicken for dinner . if they only ate number1 how many pieces does he have left ?,14 7,- number0 number1,7.0,"[1, 3, 4, 5, 6, 11, 14, 15, 16, 20, 21, 22]",4,Subtraction,frank bought his family number0 pieces of chicken for dinner . if they only ate number1,how many pieces does he have left ?
684, there number0 different books the 'crazy silly school ' series . you number1 the books how many more you still to ?,there are number0 different books in the 'crazy silly school ' series . if you read number1 of the books how many more do you still have to read ?,13 9,- number0 number1,4.0,"[1, 2, 3, 4, 16, 17, 18, 26, 27, 28]",4,Subtraction,there are number0 different books in the 'crazy silly school ' series . if you read number1 of the books,how many more do you still have to read ?
685, kale scrap paper . he could number0 drawings each page . he number1 pages how many drawings can he ?,kale was drawing on scrap paper . he could fit number0 drawings on each page . if he has number1 pages how many drawings can he make ?,5 6,* number0 number1,30.0,"[2, 6, 9, 10, 11, 13, 18, 19, 20, 24, 25, 26]",4,Multiplication,kale was drawing on scrap paper . he could fit number0 drawings on each page . if he has number1 pages,how many drawings can he make ?
686, olivia number0 quarters . she number1 them a soda how many coins she ?,olivia had number0 quarters . if she spent number1 of them buying a soda how many coins did she have left ?,11 4,- number0 number1,7.0,"[1, 2, 3, 7, 8, 9, 18, 19, 20]",4,Subtraction,olivia had number0 quarters . if she spent number1 of them buying a soda,how many coins did she have left ?
687, jerry 's freezer number0 ice cubes it . he to ice number1 cups how many pieces should he each cup to them the same amount ?,jerry 's freezer had number0 ice cubes in it . if he had to get ice for number1 cups how many pieces should he put in each cup to make them have the same amount ?,30 6,/ number0 number1,5.0,"[32, 33, 34, 3, 4, 5, 6, 16, 17, 18, 26]",4,Common-Division,jerry 's freezer had number0 ice cubes in it . if he had to get ice for number1 cups,how many pieces should he put in each cup to make them have the same amount ?
688, a potluck lunch debby number0 bottles soda . everyone only number1 the sodas how many she to back home ?,for a potluck lunch debby brought number0 bottles of soda . if everyone only drank number1 of the sodas how many did she have to take back home ?,10 8,- number0 number1,2.0,"[5, 6, 7, 14, 15, 16, 25, 26, 27]",4,Subtraction,for a potluck lunch debby brought number0 bottles of soda . if everyone only drank number1 of the sodas,how many did she have to take back home ?
689, emily number0 songs her favorite artists . later she number1 more songs . how many songs she ?,emily owned number0 songs by her favorite artists . later on she bought number1 more songs . how many songs did she have totaled ?,6 7,+ number0 number1,13.0,"[1, 2, 3, 5, 6, 12, 13, 14, 15, 21, 22, 23]",4,Addition,emily owned number0 songs by her favorite artists . later on she bought number1 more songs .,how many songs did she have totaled ?
690, bianca 's birthday number0 her friends her number1 dollars . how much money she her birthday ?,for bianca 's birthday number0 of her friends gave her number1 dollars . how much money did she get for her birthday ?,5 6,* number0 number1,30.0,"[3, 4, 5, 8, 9, 10, 11, 19, 20, 21]",4,Multiplication,for bianca 's birthday number0 of her friends gave her number1 dollars .,how much money did she get for her birthday ?
691, cody number0 dollars lawns the summer . he number1 bucks each lawn how many lawns he ?,cody made number0 dollars mowing lawns over the summer . if he charged number1 bucks for each lawn how many lawns did he mow ?,12 4,/ number0 number1,3.0,"[1, 2, 3, 12, 13, 14, 16, 21, 22, 23]",4,Common-Division,cody made number0 dollars mowing lawns over the summer . if he charged number1 bucks for each lawn,how many lawns did he mow ?
692, paige 's birthday she number0 dollars her friends and number1 dollars her relatives . how much money she her birthday ?,for paige 's birthday she received number0 dollars from her friends and number1 dollars from her relatives . how much money did she get for her birthday ?,2 3,+ number0 number1,5.0,"[5, 6, 7, 11, 12, 13, 24, 25, 26]",4,Addition,for paige 's birthday she received number0 dollars from her friends and number1 dollars from her relatives .,how much money did she get for her birthday ?
693, jerry to boxes candy . he out number0 boxes and then number1 how many boxes he ?,jerry had to sell boxes of candy . he started out with number0 boxes and then sold number1 how many boxes did he have left ?,10 5,- number0 number1,5.0,"[1, 3, 6, 11, 12, 13, 16, 17, 18, 22, 23, 24]",4,Subtraction,jerry had to sell boxes of candy . he started out with number0 boxes and then sold number1 how,many boxes did he have left ?
694, janet 's dad the family to her birthday . there number0 people total . there number1 kids and everyone else an adult . how many adults there ?,janet 's dad took the family out to eat for her birthday . there were number0 people total . there were number1 kids and everyone else was an adult . how many adults were there ?,10 8,- number0 number1,2.0,"[32, 1, 33, 34, 4, 14, 15, 16, 20, 21, 22]",4,Subtraction,janet 's dad took the family out to eat for her birthday . there were number0 people total . there were number1 kids and everyone else was an adult .,how many adults were there ?
695, lana number0 extra nickels . she them stacks number1 each stack how many stacks could she ?,lana had number0 extra nickels . if she put them into stacks with number1 in each stack how many stacks could she make ?,72 8,/ number0 number1,9.0,"[1, 2, 3, 4, 12, 13, 14, 15, 20, 21, 22]",4,Common-Division,lana had number0 extra nickels . if she put them into stacks with number1 in each stack,how many stacks could she make ?
696, haley number0 new shirts school . she number1 them how many she up ?,haley bought number0 new shirts for school . if she returned number1 of them how many did she end up with ?,11 6,- number0 number1,5.0,"[1, 2, 3, 4, 10, 11, 12, 18, 19, 20]",4,Subtraction,haley bought number0 new shirts for school . if she returned number1 of them,how many did she end up with ?
697, cody his mom wash clothes . they number0 short sleeve shirts and number1 long shirts . how many shirts they total ?,cody was helping his mom wash clothes . they washed number0 short sleeve shirts and number1 long sleeve shirts . how many shirts did they wash total ?,4 5,+ number0 number1,9.0,"[1, 3, 5, 8, 9, 10, 11, 13, 14, 15, 16, 18, 24, 25, 26]",4,Addition,cody was helping his mom wash clothes . they washed number0 short sleeve shirts and number1 long sleeve shirts .,how many shirts did they wash total ?
698, billy number0 boxes candy each box number1 pieces it . how many pieces candy he ?,billy bought number0 boxes of candy with each box having number1 pieces inside of it . how many pieces of candy did he have totaled ?,7 3,* number0 number1,21.0,"[1, 2, 3, 7, 8, 9, 10, 11, 22, 23, 24]",4,Multiplication,billy bought number0 boxes of candy with each box having number1 pieces inside of it .,how many pieces of candy did he have totaled ?
699, a mailman to number0 pieces junk mail and number1 magazines to a house . how many pieces mail he total ?,a mailman had to give number0 pieces of junk mail and number1 magazines to a house . how many pieces of mail did he deliver total ?,6 5,+ number0 number1,11.0,"[1, 4, 5, 6, 7, 10, 11, 12, 23, 24, 25]",4,Addition,a mailman had to give number0 pieces of junk mail and number1 magazines to a house .,how many pieces of mail did he deliver total ?
700, the roller coaster the state fair costs number0 tickets ride . number1 friends to the roller coaster how many tickets would they ?,the roller coaster at the state fair costs number0 tickets per ride . if number1 friends were going to ride the roller coaster how many tickets would they need ?,6 8,* number0 number1,48.0,"[4, 7, 8, 9, 10, 11, 13, 14, 15, 26, 27, 28]",4,Multiplication,the roller coaster at the state fair costs number0 tickets per ride . if number1 friends were going to ride the roller coaster,how many tickets would they need ?
701, paige her mom plant flowers and together they number0 seeds . they number1 seeds each flower how many flower beds they ?,paige was helping her mom plant flowers and together they planted number0 seeds . if they put number1 seeds in each flower bed how many flower beds did they have ?,54 6,/ number0 number1,9.0,"[2, 10, 11, 12, 16, 17, 18, 20, 27, 28, 29]",4,Common-Division,paige was helping her mom plant flowers and together they planted number0 seeds . if they put number1 seeds in each flower bed,how many flower beds did they have ?
702, nancy soap her bathroom . she number0 packs each pack number1 bars . how many bars soap she ?,nancy was buying soap for her bathroom . she bought number0 packs with each pack having number1 bars . how many bars of soap did she buy ?,6 5,* number0 number1,30.0,"[1, 7, 9, 10, 11, 13, 15, 16, 17, 24, 25, 26]",4,Multiplication,nancy was buying soap for her bathroom . she bought number0 packs with each pack having number1 bars .,how many bars of soap did she buy ?
703, a group number0 friends video games . later number1 more friends over . how many people there total ?,a group of number0 friends were playing video games . later number1 more friends came over . how many people were there total ?,4 3,+ number0 number1,7.0,"[2, 3, 4, 10, 11, 12, 13, 20, 21, 22]",4,Addition,a group of number0 friends were playing video games . later number1 more friends came over .,how many people were there total ?
704, oliver number0 tickets games the arcade . he number1 tickets a water gun how many tickets he still ?,oliver won number0 tickets playing games at the arcade . if he spent number1 tickets buying a water gun how many tickets did he still have ?,11 5,- number0 number1,6.0,"[1, 2, 3, 10, 12, 13, 14, 15, 23, 24, 25]",4,Subtraction,oliver won number0 tickets playing games at the arcade . if he spent number1 tickets buying a water gun,how many tickets did he still have ?
705, the fair number0 rides the first day he and number1 rides the second day . how many times he total ?,at the fair dave rode number0 rides the first day he went and number1 rides the second day . how many times did he ride total ?,4 3,+ number0 number1,7.0,"[4, 5, 6, 12, 13, 14, 23, 24, 25]",4,Addition,at the fair dave rode number0 rides the first day he went and number1 rides the second day .,how many times did he ride total ?
706, janet a marathon . she number0 days number1 miles each day . how many miles janet altogether ?,janet was practicing for a marathon . she practiced for number0 days running number1 miles each day . how many miles did janet run altogether ?,9 8,* number0 number1,72.0,"[1, 5, 9, 10, 11, 12, 13, 14, 15, 22, 23, 24]",4,Multiplication,janet was practicing for a marathon . she practiced for number0 days running number1 miles each day .,how many miles did janet run altogether ?
707, edward basketball his friend . together they number0 points . edward number1 the points . how many points his friend score ?,edward was playing basketball with his friend . together they scored number0 points . if edward scored number1 of the points . how many points did his friend score ?,13 7,- number0 number1,6.0,"[1, 2, 6, 10, 11, 12, 16, 17, 18, 26, 27, 28]",4,Subtraction,edward was playing basketball with his friend . together they scored number0 points . if edward scored number1 of the points .,how many points did his friend score ?
708, tiffany hand towels her house . she number0 packs each pack number1 towels it . how many towels she ?,tiffany was buying hand towels for her house . she bought number0 packs with each pack having number1 towels in it . how many towels did she buy ?,9 3,* number0 number1,27.0,"[1, 2, 5, 7, 10, 11, 12, 14, 16, 17, 18, 25, 26, 27]",4,Multiplication,tiffany was buying hand towels for her house . she bought number0 packs with each pack having number1 towels in it .,how many towels did she buy ?
709, debby her spare change stacks . number0 stack number1 coins and the other number2 how many coins she total ?,debby was placing her spare change into stacks . number0 stack had number1 coins and the other had number2 how many coins did she have total ?,1 4 8,+ number1 number2,12.0,"[1, 2, 5, 9, 10, 11, 12, 13, 17, 18, 19, 23, 24, 25]",4,Addition,debby was placing her spare change into stacks . number0 stack had number1 coins and the other had number2 how,many coins did she have total ?
710, faye number0 apps her phone . to up some space she number1 the apps . how many apps she ?,faye had number0 apps on her phone . to free up some space she deleted number1 of the apps . how many apps did she have left ?,12 8,- number0 number1,4.0,"[1, 2, 3, 6, 14, 15, 16, 24, 25, 26]",4,Subtraction,faye had number0 apps on her phone . to free up some space she deleted number1 of the apps .,how many apps did she have left ?
711, bianca a marathon . to she number0 miles the first day and number1 miles the next day . how many miles altogether ?,bianca was practicing for a marathon . to prepare she ran number0 miles the first day and number1 miles the next day . how many miles did bianca run altogether ?,8 4,+ number0 number1,12.0,"[1, 3, 5, 10, 11, 12, 16, 17, 18, 27, 28, 29]",4,Addition,bianca was practicing for a marathon . to prepare she ran number0 miles the first day and number1 miles the next day .,how many miles did bianca run altogether ?
712, jerry number0 action figures a shelf his room . later he number1 more figures to the shelf . how many action figures his shelf total ?,jerry had number0 action figures on a shelf in his room . later he added number1 more figures to the shelf . how many action figures were on his shelf total ?,8 2,+ number0 number1,10.0,"[1, 2, 3, 4, 8, 14, 15, 16, 17, 28, 29, 30]",4,Addition,jerry had number0 action figures on a shelf in his room . later he added number1 more figures to the shelf .,how many action figures were on his shelf total ?
713, sarah number0 new shirts school . she already number1 shirts how many she total ?,sarah bought number0 new shirts for school . if she already had number1 shirts how many did she own total ?,8 9,+ number0 number1,17.0,"[1, 2, 3, 4, 11, 12, 13, 17, 18, 19]",4,Addition,sarah bought number0 new shirts for school . if she already had number1 shirts,how many did she own total ?
714, books astronomy . he number0 books the planets and number1 the space program . how many books he total ?,ned was buying books about astronomy . he bought number0 books about the planets and number1 about the space program . how many books did he buy total ?,8 4,+ number0 number1,12.0,"[1, 2, 5, 8, 9, 10, 14, 15, 16, 25, 26, 27]",4,Addition,ned was buying books about astronomy . he bought number0 books about the planets and number1 about the space program .,how many books did he buy total ?
715, a delivery driver to number0 stops his route . he those deliveries he number1 more stops . how many stops he total ?,a delivery driver had to make number0 stops on his route . after he finished those deliveries he made number1 more stops . how many stops did he make total ?,3 4,+ number0 number1,7.0,"[1, 5, 6, 7, 8, 18, 19, 20, 21, 27, 28, 29]",4,Addition,a delivery driver had to make number0 stops on his route . after he finished those deliveries he made number1 more stops .,how many stops did he make total ?
716, emily 's mom extra school supplies emily and her sister . she number0 packs glue sticks total . she emily number1 packs how many her sister get ?,emily 's mom was buying extra school supplies for emily and her sister . she bought number0 packs of glue sticks total . if she gave emily number1 packs how many did her sister get ?,13 6,- number0 number1,7.0,"[32, 1, 2, 33, 34, 15, 16, 17, 26, 27, 28]",4,Subtraction,emily 's mom was buying extra school supplies for emily and her sister . she bought number0 packs of glue sticks total . if she gave emily number1 packs,how many did her sister get ?
717, roger his favorite book series . he number0 books to total . he number1 books each week how many weeks would it him to the series ?,roger was reading through his favorite book series . he had number0 books to read total . if he read number1 books each week how many weeks would it take him to finish the series ?,30 6,/ number0 number1,5.0,"[32, 1, 2, 33, 34, 10, 11, 12, 19, 20, 21, 22]",4,Common-Division,roger was reading through his favorite book series . he had number0 books to read total . if he read number1 books each week,how many weeks would it take him to finish the series ?
718, rachel to number0 pages math homework and number1 pages homework . how many pages she to total ?,rachel had to complete number0 pages of math homework and number1 pages of reading homework . how many pages did she have to complete total ?,9 2,+ number0 number1,11.0,"[1, 3, 4, 5, 7, 9, 10, 11, 22, 23, 24]",4,Addition,rachel had to complete number0 pages of math homework and number1 pages of reading homework .,how many pages did she have to complete total ?
719, haley number0 cans . she number1 cans number2 bag how many cans she ?,haley collected number0 cans for recycling . if she put number1 cans in number2 bag how many cans did she have left ?,9 7 1,- number0 number1,2.0,"[1, 2, 3, 9, 10, 11, 12, 13, 14, 19, 20, 21]",4,Subtraction,haley collected number0 cans for recycling . if she put number1 cans in number2 bag,how many cans did she have left ?
720, amy different soups . she number0 cans chicken soup and number1 cans tomato soup . how many soups she ?,amy was buying different soups . she bought number0 cans of chicken soup and number1 cans of tomato soup . how many soups did she buy ?,6 3,+ number0 number1,9.0,"[1, 7, 8, 9, 13, 14, 15, 23, 24, 25]",4,Addition,amy was buying different soups . she bought number0 cans of chicken soup and number1 cans of tomato soup .,how many soups did she buy ?
721, a vase can number0 flowers . you number1 flowers how many vases would you ?,a vase can hold number0 flowers . if you had number1 flowers how many vases would you need ?,5 25,/ number1 number0,5.0,"[2, 3, 4, 5, 9, 10, 11, 15, 16, 17]",4,Common-Division,a vase can hold number0 flowers . if you had number1 flowers,how many vases would you need ?
722, adam his favorite book series . the first week he number0 different books . the next week he number1 books . how many books he total ?,adam was reading through his favorite book series . the first week he read number0 different books . the next week he read number1 books . how many books did he read total ?,5 8,+ number0 number1,13.0,"[32, 1, 4, 5, 6, 13, 14, 15, 16, 22, 23, 24, 30, 31]",4,Addition,adam was reading through his favorite book series . the first week he read number0 different books . the next week he read number1 books .,how many books did he read total ?
723, paige 's dresser drawers could number0 pieces clothing each . she number1 drawers how many pieces clothing could it ?,paige 's dresser drawers could hold number0 pieces of clothing each . if she had number1 drawers how many pieces of clothing could it hold ?,2 4,* number0 number1,8.0,"[2, 5, 6, 7, 10, 12, 14, 15, 16, 22, 23, 24]",4,Multiplication,paige 's dresser drawers could hold number0 pieces of clothing each . if she had number1 drawers,how many pieces of clothing could it hold ?
724, an architect a hotel downtown . he it number0 stories number1 rooms each story . how many rooms the hotel ?,an architect was building a hotel downtown . he built it number0 stories tall with number1 rooms on each story . how many rooms does the hotel have totaled ?,3 8,* number0 number1,24.0,"[1, 7, 10, 11, 12, 14, 15, 16, 18, 26, 27, 28]",4,Multiplication,an architect was building a hotel downtown . he built it number0 stories tall with number1 rooms on each story .,how many rooms does the hotel have totaled ?
725, isabel number0 dollars her birthday . later she some toys cost number1 dollars each . how many the toys could she ?,isabel received number0 dollars for her birthday . later she found some toys that cost number1 dollars each . how many of the toys could she buy ?,14 2,/ number0 number1,7.0,"[1, 2, 3, 6, 14, 15, 16, 17, 24, 25, 26]",4,Common-Division,isabel received number0 dollars for her birthday . later she found some toys that cost number1 dollars each .,how many of the toys could she buy ?
726, there number0 students a class . the teacher them groups number1 students each group how many groups would she ?,there are number0 students in a class . if the teacher put them into groups with number1 students in each group how many groups would she have ?,30 5,/ number0 number1,6.0,"[1, 2, 3, 15, 16, 17, 19, 24, 25, 26]",4,Common-Division,there are number0 students in a class . if the teacher put them into groups with number1 students in each group,how many groups would she have ?
727, haley 's mom extra school supplies haley and her sister . she number0 reams paper haley and number1 reams her sister how many she total ?,haley 's mom was buying extra school supplies for haley and her sister . if she bought number0 reams of paper for haley and number1 reams for her sister how many did she buy total ?,2 3,+ number0 number1,5.0,"[32, 33, 2, 34, 16, 17, 18, 23, 24, 25]",4,Addition,haley 's mom was buying extra school supplies for haley and her sister . if she bought number0 reams of paper for haley and number1 reams for her sister,how many did she buy total ?
728, there number0 students the school band . the band instructor the students rows number1 students each row how many rows could he ?,there are number0 students in the school band . if the band instructor put the students into rows with number1 students in each row how many rows could he make ?,40 5,/ number0 number1,8.0,"[1, 2, 3, 4, 18, 19, 20, 22, 27, 28, 29]",4,Common-Division,there are number0 students in the school band . if the band instructor put the students into rows with number1 students in each row,how many rows could he make ?
729, roger his lawn number0 times total the spring and summer . he it number1 times the summer . how many times he the spring ?,roger mowed his lawn number0 times total during the spring and summer . if he mowed it number1 times in the summer . how many times did he mow in the spring ?,15 9,- number0 number1,6.0,"[1, 3, 4, 5, 16, 17, 18, 29, 30, 31]",4,Subtraction,roger mowed his lawn number0 times total during the spring and summer . if he mowed it number1 times in the summer .,how many times did he mow in the spring ?
