,Question,orig_Question,Numbers,Equation,Answer,group_nums,Grade,Type,Body,Ques_Statement
226, next she to a country full mountains . there she number0 species insects reptiles and birds . she number1 insect species and number2 bird species how many reptile species she ?,next she went to a country full of mountains . there she saw number0 species of insects reptiles and birds . if she saw number1 insect species and number2 bird species how many reptile species did she see ?,532 253 143,- number0 + number1 number2,136.0,"[2, 35, 36, 37, 11, 12, 13, 14, 16, 23, 24, 25, 26, 27, 28, 29, 30]",3,Subtraction,next she went to a country full of mountains . there she saw number0 species of insects reptiles and birds . if she saw number1 insect species and number2 bird species,how many reptile species did she see ?
227, the mountain country she to the famous beach the continent . there she number0 seashells different colors . she number1 red shells and number2 green shells how many shells not red or green ?,after the mountain country she went to the famous beach on the continent . there she collected number0 seashells of different colors . if she has number1 red shells and number2 green shells how many shells are not red or green ?,291 76 49,- number0 + number1 number2,166.0,"[32, 2, 4, 38, 39, 8, 40, 11, 15, 16, 17, 18, 25, 26, 27, 28, 29, 30, 31]",3,Subtraction,after the mountain country she went to the famous beach on the continent . there she collected number0 seashells of different colors . if she has number1 red shells and number2 green shells,how many shells are not red or green ?
228, thanksgiving and dr. mary to it her blessing to different charities . she first to where she $ number0 total to number1 different nursing homes . she $ number2 to the first home and $ number3 to the second how much she to the third home ?,thanksgiving is coming and dr. mary wants to celebrate it by sharing her blessing to different charities . she first went to oldtown where she donated $ number0 in total to number1 different nursing homes . if she gave $ number2 to the first home and $ number3 to the second how much did she give to the third home ?,700.00 3 245.00 225.00,- number0 + number2 number3,230.0,"[32, 34, 2, 58, 39, 40, 41, 7, 59, 46, 47, 48, 14, 57, 26, 27, 28, 30, 31]",3,Subtraction,thanksgiving is coming and dr. mary wants to celebrate it by sharing her blessing to different charities . she first went to oldtown where she donated $ number0 in total to number1 different nursing homes . if she gave $ number2 to the first home and $ number3 to the second,how much did she give to the third home ?
229, she then to number0 orphanages and a total $ number1 . she $ number2 to the first orphanage and $ number3 to the third how much she to the second orphanage ?,she then went to number0 orphanages and donated a total of $ number1 . if she gave $ number2 to the first orphanage and $ number3 to the third how much did she donate to the second orphanage ?,3 650.00 175.00 250.00,- number1 + number2 number3,225.0,"[2, 3, 4, 5, 35, 36, 37, 11, 12, 17, 18, 19, 24, 25, 26]",3,Subtraction,she then went to number0 orphanages and donated a total of $ number1 . if she gave $ number2 to the first orphanage and $ number3 to the third,how much did she donate to the second orphanage ?
230, next her list the homeless people where she a total $ number0 . she $ number1 to the first set homeless families and $ number2 to the second set families how much she to the last set homeless families ?,next on her list are the homeless people where she spent a total of $ number0 . if she gave $ number1 to the first set of homeless families and $ number2 to the second set of families how much did she give to the last set of homeless families ?,900.00 325.00 260.00,- number0 + number1 number2,315.0,"[32, 2, 14, 15, 47, 48, 49, 20, 21, 22, 30, 31]",3,Subtraction,next on her list are the homeless people where she spent a total of $ number0 . if she gave $ number1 to the first set of homeless families and $ number2 to the second set of families,how much did she give to the last set of homeless families ?
231, lastly she $ number0 to number1 different soup kitchens her town . she $ number2 to the first soup kitchen and $ number3 to the second how much she to the third ?,lastly she donated $ number0 to number1 different soup kitchens in her town . if she gave $ number2 to the first soup kitchen and $ number3 to the second how much did she donate to the third ?,800.00 3 300.00 238.00,- number0 + number2 number3,262.0,"[2, 3, 4, 5, 6, 7, 35, 9, 36, 37, 17, 18, 19, 25, 26, 27]",3,Subtraction,lastly she donated $ number0 to number1 different soup kitchens in her town . if she gave $ number2 to the first soup kitchen and $ number3 to the second,how much did she donate to the third ?
232, andrew his friends game night . so he to the snacks and the games . he mini sandwiches . he number0 friends over and he number1 sandwiches each one them how many sandwiches he total ?,andrew is having his friends over for game night . so he decided to prepare the snacks and the games . he started by making mini sandwiches . if he has number0 friends coming over and he made number1 sandwiches for each one of them how many sandwiches did he make in total ?,4 3,* number0 number1,12.0,"[32, 2, 3, 37, 38, 39, 41, 9, 18, 50, 51, 52, 22, 30, 31]",3,Multiplication,andrew is having his friends over for game night . so he decided to prepare the snacks and the games . he started by making mini sandwiches . if he has number0 friends coming over and he made number1 sandwiches for each one of them,how many sandwiches did he make in total ?
233, he also some juice fresh oranges . he number0 oranges glass juice and he number1 glasses juice how many oranges he ?,he also made some juice from fresh oranges . if he used number0 oranges per glass of juice and he made number1 glasses of juice how many oranges did he use ?,2 6,* number0 number1,12.0,"[2, 6, 11, 12, 13, 14, 17, 20, 21, 22, 28, 29, 30]",3,Multiplication,he also made some juice from fresh oranges . if he used number0 oranges per glass of juice and he made number1 glasses of juice,how many oranges did he use ?
234, lastly andrew to his expenses the game night . he $ number0 each game they and they a total number1 games how much money he that night ?,lastly andrew tried to compute his expenses for the game night . if he spent $ number0 for each game they played and they played a total of number1 games how much money did he spend that night ?,9.00 5,* number0 number1,45.0,"[2, 35, 36, 37, 15, 16, 17, 18, 27, 28, 29]",3,Multiplication,lastly andrew tried to compute his expenses for the game night . if he spent $ number0 for each game they played and they played a total of number1 games,how much money did he spend that night ?
235, her mom also some cookies . she number0 pans cookies and there number1 cookies pan how many cookies her mom bake her birthday ?,her mom also baked some cookies . if she baked number0 pans of cookies and there are number1 cookies per pan how many cookies did her mom bake for her birthday ?,5 8,* number0 number1,40.0,"[2, 3, 9, 10, 11, 15, 16, 17, 18, 19, 20, 28, 29, 30]",3,Multiplication,her mom also baked some cookies . if she baked number0 pans of cookies and there are number1 cookies per pan,how many cookies did her mom bake for her birthday ?
236, they to some cold drinks as well . they to number0 pitchers drinks and each pitcher can number1 glasses how many glasses drinks they to total ?,they planned to serve some cold drinks as well . if they plan to make number0 pitchers of drinks and each pitcher can fill number1 glasses how many glasses of drinks are they planning to prepare in total ?,9 6,* number0 number1,54.0,"[35, 4, 36, 37, 13, 14, 15, 16, 17, 20, 23, 24, 25]",3,Multiplication,they planned to serve some cold drinks as well . if they plan to make number0 pitchers of drinks and each pitcher can fill number1 glasses,how many glasses of drinks are they planning to prepare in total ?
237, they to the party their backyard . they number0 sets tables and each set number1 chairs how many chairs they the guests ?,they decided to hold the party in their backyard . if they have number0 sets of tables and each set has number1 chairs how many chairs do they have for the guests ?,8 7,* number0 number1,56.0,"[2, 10, 12, 13, 14, 18, 20, 21, 22, 29, 30, 31]",3,Multiplication,they decided to hold the party in their backyard . if they have number0 sets of tables and each set has number1 chairs,how many chairs do they have for the guests ?
238, the end the party mona away some souvenirs to her number0 closest friends . each them number1 souvenir items how many souvenirs mona away ?,at the end of the party mona gave away some souvenirs to her number0 closest friends . if each of them received number1 souvenir items how many souvenirs did mona give away ?,6 2,* number0 number1,12.0,"[4, 12, 13, 14, 15, 18, 21, 22, 23, 24, 29, 30, 31]",3,Multiplication,at the end of the party mona gave away some souvenirs to her number0 closest friends . if each of them received number1 souvenir items,how many souvenirs did mona give away ?
239, john a tree house to his hideout whenever he to some time alone himself . the first thing he to some materials . the pillars he number0 sets wood different lengths . the first set wood number1 feet long and the second set number2 times longer the first how long the second set wood ?,john is building a tree house to serve as his hideout whenever he wanted to spend some time alone with himself . the first thing he did is to gather some materials . for the pillars he needs number0 sets of wood with different lengths . if the first set of wood is number1 feet long and the second set is number2 times longer than the first set how long is the second set of wood ?,2 4 5,* number1 number2,20.0,"[37, 38, 39, 73, 74, 75, 15, 52, 53, 54, 60, 61, 62]",3,Multiplication,john is building a tree house to serve as his hideout whenever he wanted to spend some time alone with himself . the first thing he did is to gather some materials . for the pillars he needs number0 sets of wood with different lengths . if the first set of wood is number1 feet long and the second set is number2 times longer than the first set,how long is the second set of wood ?
240, another material he rope . he already number0 feet rope and he additional ropes number1 times the length what he already how long should the additional rope ?,another material that he needs is rope . if he already has number0 feet of rope and he needs additional ropes having number1 times the length of what he already have how long should be the additional rope ?,6 5,* number0 number1,30.0,"[3, 35, 36, 37, 11, 12, 13, 21, 22, 23]",3,Multiplication,another material that he needs is rope . if he already has number0 feet of rope and he needs additional ropes having number1 times the length of what he already have,how long should be the additional rope ?
241, the walls the house he would number0 large planks wood . each plank wood needs number1 pieces nails to how many nails john the house wall ?,for the walls of the house he would use number0 large planks of wood . if each plank of wood needs number1 pieces of nails to be secured how many nails does john need for the house wall ?,9 8,* number0 number1,72.0,"[35, 36, 5, 37, 8, 9, 10, 11, 16, 20, 21, 22]",3,Multiplication,for the walls of the house he would use number0 large planks of wood . if each plank of wood needs number1 pieces of nails to be secured,how many nails does john need for the house wall ?
242, the roof john would number0 sets metal bars support . each set number1 metal how many metal bars there all ?,for the roof john would need number0 sets of metal bars for support . if each set has number1 metal bars how many metal bars are there in all ?,2 7,* number0 number1,14.0,"[3, 5, 6, 7, 8, 12, 15, 17, 18, 19, 20, 26, 27, 28]",3,Multiplication,for the roof john would need number0 sets of metal bars for support . if each set has number1 metal bars,how many metal bars are there in all ?
243, the final touches john to the house the number0 primary colors . he number1 liters paint each color how many liters paint he all ?,for the final touches john wanted to paint the house using the number0 primary colors . if he has number1 liters of paint for each color how many liters of paint does he have in all ?,3 5,* number0 number1,15.0,"[33, 2, 34, 35, 10, 11, 12, 13, 14, 17, 18, 19, 20, 24]",3,Multiplication,for the final touches john wanted to paint the house using the number0 primary colors . if he has number1 liters of paint for each color,how many liters of paint does he have in all ?
244, the kids oakwood elementary school a bird zoo their field trip . to to the bird zoo the school the kids to some buses . there number0 buses and each bus number1 adult supervisors to the children how many supervisors there total ?,the kids from oakwood elementary school are visiting a bird zoo for their field trip . to get to the bird zoo from the school the kids have to ride some buses . if there are number0 buses and each bus has number1 adult supervisors to guide the children how many supervisors are there in total ?,7 3,* number0 number1,21.0,"[2, 35, 36, 37, 39, 8, 41, 42, 43, 44, 10, 17, 20, 53, 54, 55, 29]",3,Multiplication,the kids from oakwood elementary school are visiting a bird zoo for their field trip . to get to the bird zoo from the school the kids have to ride some buses . if there are number0 buses and each bus has number1 adult supervisors to guide the children,how many supervisors are there in total ?
245, each bus number0 rows seats and each row seats can number1 children how many children can each accommodate ?,if each bus have number0 rows of seats and each row of seats can accommodate number1 children how many children can each bus accommodate ?,9 4,* number0 number1,36.0,"[1, 3, 4, 5, 9, 14, 15, 16, 18, 21, 22, 23]",3,Multiplication,if each bus have number0 rows of seats and each row of seats can accommodate number1 children,how many children can each bus accommodate ?
246, the bird the kids able to number0 different bird cages each number1 different kinds birds . how many different kinds birds the children the bird cages ?,at the bird zoo the kids were able to visit number0 different bird cages each containing number1 different kinds of birds . how many different kinds of birds did the children see from the bird cages ?,5 8,* number0 number1,40.0,"[1, 2, 33, 34, 35, 9, 10, 11, 13, 14, 15, 16, 17, 18]",3,Multiplication,at the bird zoo the kids were able to visit number0 different bird cages each containing number1 different kinds of birds .,how many different kinds of birds did the children see from the bird cages ?
247, the back the zoo a mountain where the birds can free a natural habitat . the children number0 types eagles each section the mountain . the mountain number1 sections how many types eagles the children total ?,at the back of the zoo is a mountain where the birds can roam free in a natural habitat . the children saw number0 types of eagles living on each section of the mountain . if the mountain has number1 sections how many types of eagles did the children see in total ?,6 3,* number0 number1,18.0,"[2, 3, 38, 39, 40, 7, 14, 49, 50, 51, 22, 23, 24, 29]",3,Multiplication,at the back of the zoo is a mountain where the birds can roam free in a natural habitat . the children saw number0 types of eagles living on each section of the mountain . if the mountain has number1 sections,how many types of eagles did the children see in total ?
248, their last stop the zoo the bird museum . there they number0 bird exhibits number1 minutes each exhibit . how much time they the museum ?,their last stop before leaving the zoo is the bird museum . there they went through number0 bird exhibits spending number1 minutes going around each exhibit . how much time did they spend going through the museum ?,7 9,* number0 number1,63.0,"[34, 35, 36, 7, 15, 16, 17, 18, 19, 20, 21, 24]",3,Multiplication,their last stop before leaving the zoo is the bird museum . there they went through number0 bird exhibits spending number1 minutes going around each exhibit .,how much time did they spend going through the museum ?
249, annie trick or seriously . so days halloween she sure the details her trick or treating well . first she to out the number houses her village . the village number0 houses block and a total number1 blocks how many houses there her village ?,annie takes trick or treating seriously . so days before halloween she makes sure that the details of her trick or treating are well planned . first she wanted to find out the number of houses in her village . if the village has number0 houses per block and has a total of number1 blocks how many houses are there in her village ?,5 9,* number0 number1,45.0,"[3, 43, 44, 45, 46, 16, 19, 52, 53, 54, 60, 61, 62]",3,Multiplication,annie takes trick or treating seriously . so days before halloween she makes sure that the details of her trick or treating are well planned . first she wanted to find out the number of houses in her village . if the village has number0 houses per block and has a total of number1 blocks,how many houses are there in her village ?
250, she also the number candies she will each block . she will number0 pieces candies every house and there number1 houses a block how many candies will she each block ?,she also estimated the number of candies that she will receive from each block . if she will receive around number0 pieces of candies from every house and there are number1 houses in a block how many candies will she receive from each block ?,7 5,* number0 number1,35.0,"[3, 41, 42, 43, 12, 14, 19, 20, 21, 25, 29, 30, 31]",3,Multiplication,she also estimated the number of candies that she will receive from each block . if she will receive around number0 pieces of candies from every house and there are number1 houses in a block,how many candies will she receive from each block ?
251, she to how many children will trick or their village . there number0 children each the number1 how many children will trick or annie 's village ?,she wants to know how many children will go trick or treating in their village . if there are number0 children on each of the number1 blocks how many children will go trick or treating in annie 's village ?,6 9,* number0 number1,54.0,"[2, 36, 5, 37, 38, 8, 12, 15, 18, 19, 20, 22, 24, 25, 26]",3,Multiplication,she wants to know how many children will go trick or treating in their village . if there are number0 children on each of the number1 blocks,how many children will go trick or treating in annie 's village ?
252, annie also the time she would the number0 blocks her village . she spending just number1 minutes each block how much time would it her to trick or treating ?,annie also planned the time she would spend going around the number0 blocks in her village . if she plans on spending just number1 minutes on each block how much time would it take for her to finish trick or treating ?,9 8,* number0 number1,72.0,"[4, 38, 39, 40, 10, 11, 12, 22, 23, 24, 26]",3,Multiplication,annie also planned the time she would spend going around the number0 blocks in her village . if she plans on spending just number1 minutes on each block,how much time would it take for her to finish trick or treating ?
253, finally she to the halloween party the village club house . she to sure she will the perfect costume she number0 different costumes the halloween store . each costume rent $ number1 how much she all the costumes ?,finally she planned on going to the halloween party in the village club house . she wanted to make sure that she will have the perfect costume so she rented number0 different costumes from the halloween store . if each costume rent costs $ number1 how much did she spend on all the costumes ?,4 2.00,* number0 number1,8.0,"[32, 4, 39, 43, 44, 45, 14, 16, 51, 52, 53, 29, 30, 31]",3,Multiplication,finally she planned on going to the halloween party in the village club house . she wanted to make sure that she will have the perfect costume so she rented number0 different costumes from the halloween store . if each costume rent costs $ number1,how much did she spend on all the costumes ?
254, his favorite michael number0 times more robots tom . tom number1 how many robots michael ?,being his favorite michael has number0 times more flying robots than tom . if tom has number1 flying robots how many flying robots does michael have ?,4 3,* number0 number1,12.0,"[2, 4, 5, 6, 7, 8, 12, 15, 16, 17, 18, 23, 24, 25]",3,Multiplication,being his favorite michael has number0 times more flying robots than tom . if tom has number1 flying robots,how many flying robots does michael have ?
255, tom michael the rare robot that would number0 his robot sets . michael to it but he tom will to number1 times the original price . the rare robot an original price $ number2 how much should ?,tom saw that michael has the rare robot that would complete number0 of his robot sets . michael offered to sell it but he said that tom will need to pay number1 times the original price . if the rare robot has an original price of $ number2 how much should tom pay ?,1 3 3.00,* number1 number2,9.0,"[32, 10, 11, 12, 46, 47, 48, 50, 51, 52, 30, 31]",3,Multiplication,tom saw that michael has the rare robot that would complete number0 of his robot sets . michael offered to sell it but he said that tom will need to pay number1 times the original price . if the rare robot has an original price of $ number2,how much should tom pay ?
256, they the meeting tom the total number robots his collection . he number0 sets robots and each set number1 robots . how many robots tom his collection ?,before they end the meeting tom counted the total number of robots in his collection . he has number0 sets of robots and each set is composed of number1 robots . how many robots does tom have in his collection ?,6 7,* number0 number1,42.0,"[1, 5, 37, 38, 39, 17, 18, 19, 23, 27, 28, 29]",3,Multiplication,before they end the meeting tom counted the total number of robots in his collection . he has number0 sets of robots and each set is composed of number1 robots .,how many robots does tom have in his collection ?
257, it valentine 's day the city and mayor harvey to the institutions women some flowers . his first beneficiary the nursing home old women . he number0 sets flowers number1 pieces each . how many flowers he the nursing home ?,it 's valentine 's day in the city and mayor harvey wants to celebrate by giving the institutions for women some flowers . his first beneficiary was the nursing home for old women . he bought number0 sets of flowers number1 pieces each . how many flowers did he buy for the nursing home ?,3 90,* number0 number1,270.0,"[1, 35, 36, 37, 39, 40, 41, 42, 51, 52, 53]",3,Multiplication,it 's valentine 's day in the city and mayor harvey wants to celebrate by giving the institutions for women some flowers . his first beneficiary was the nursing home for old women . he bought number0 sets of flowers number1 pieces each .,how many flowers did he buy for the nursing home ?
258, vice-mayor alexander to the mayor 's advocacy . he a party and the whole city to . he number0 caterers number1 employees each how many people the party ?,vice-mayor alexander wanted to join in with the mayor 's advocacy . he organized a party and invited the whole city to attend . if he hired number0 caterers having number1 employees each how many people are working for the party ?,5 50,* number0 number1,250.0,"[32, 2, 5, 38, 39, 40, 26, 27, 28, 29, 30, 31]",3,Multiplication,vice-mayor alexander wanted to join in with the mayor 's advocacy . he organized a party and invited the whole city to attend . if he hired number0 caterers having number1 employees each,how many people are working for the party ?
259, the day they able to number0 institutions happy . each institution number1 people . how many people happy the mayor and vice-mayor ?,after the day they were able to make number0 institutions happy . if each institution has number1 people . how many people were made happy by the mayor and vice-mayor ?,6 80,* number0 number1,480.0,"[1, 3, 7, 8, 9, 13, 15, 16, 17, 27, 28, 29]",3,Multiplication,after the day they were able to make number0 institutions happy . if each institution has number1 people .,how many people were made happy by the mayor and vice-mayor ?
260, dean to the beach his friends to the last weeks summer . when they to the beach they a house them to a couple weeks . there number0 them dean and each $ number1 the rent how much they total ?,dean went to the beach with his friends to enjoy the last weeks of summer . when they got to the beach they rented a house for them to stay in for a couple of weeks . if there are number0 of them including dean and each paid $ number1 for the rent how much did they pay in total ?,7 70.00,* number0 number1,490.0,"[39, 40, 41, 10, 46, 48, 49, 50, 57, 58, 59]",3,Multiplication,dean went to the beach with his friends to enjoy the last weeks of summer . when they got to the beach they rented a house for them to stay in for a couple of weeks . if there are number0 of them including dean and each paid $ number1 for the rent,how much did they pay in total ?
