,Question,orig_Question,Numbers,Equation,Answer,group_nums,Grade,Type,Body,Ques_Statement
447, number0 students number1 portfolios paintings student number portfolios portfolios paintings,number0 students split number1 portfolios of paintings . each student should get the same number of portfolios . how many portfolios of paintings will each of them get ?,15 122,/ number1 number0,8.133333333333333,"[0, 1, 2, 3, 4, 8, 9, 24, 25, 26, 27]",5,Floor-Division,number0 students split number1 portfolios of paintings . each student should get the same number of portfolios .,how many portfolios of paintings will each of them get ?
448, number0 students teams mountaineering competition team number1 students teams,number0 students are forming teams for a mountaineering competition . each team should have number1 students . how many teams can they form ?,172 18,/ number0 number1,9.555555555555555,"[0, 1, 3, 10, 13, 14, 15, 20, 21, 22]",5,Floor-Division,number0 students are forming teams for a mountaineering competition . each team should have number1 students .,how many teams can they form ?
449, mr. lee number0 tons fruits truck number1 tons fruits truck number2 tons order number trucks truck trucks,mr. lee wants to load number0 tons of his fruits . a large truck can load number1 tons of fruits and small truck can load number2 tons . in order to use the least number of trucks and have every truck fully occupied how many large trucks should be used ?,134 15 7,/ number0 number1,8.933333333333334,"[4, 5, 6, 39, 13, 15, 16, 17, 47, 48, 49, 24, 25, 26]",5,Floor-Division,mr. lee wants to load number0 tons of his fruits . a large truck can load number1 tons of fruits and small truck can load number2 tons . in order to use the least number of trucks and have every truck fully occupied,how many large trucks should be used ?
450, tourist group number0 people hotel rooms number1 people rooms number2 order number rooms room rooms,a tourist group has number0 people . at a hotel they want to rent some large rooms for number1 people each and some small rooms for number2 each . in order to rent the least number of rooms and have every room fully occupied how many large rooms should be rented ?,26 3 2,/ number0 number1,8.666666666666666,"[3, 4, 5, 40, 48, 17, 18, 19, 20, 49, 50, 25, 26, 27]",5,Floor-Division,a tourist group has number0 people . at a hotel they want to rent some large rooms for number1 people each and some small rooms for number2 each . in order to rent the least number of rooms and have every room fully occupied,how many large rooms should be rented ?
451, ballet class number0 members groups number1 members groups number2 members order number groups groups,a ballet class wants to divide its number0 members into some large groups at number1 members each and some small groups at number2 members each . in order to make the least number of groups how many large groups should be made ?,90 7 3,/ number0 number1,12.857142857142858,"[5, 6, 7, 8, 39, 40, 41, 13, 14, 15, 16, 21, 22, 23, 24]",5,Floor-Division,a ballet class wants to divide its number0 members into some large groups at number1 members each and some small groups at number2 members each . in order to make the least number of groups,how many large groups should be made ?
452, number0 ml tea pot tea cups number1 ml tea cup cups tea,there was number0 ml of tea in a pot . anna poured the tea into some cups . if there were number1 ml of tea in each cup how many cups were filled with tea ?,1050 65,/ number0 number1,16.153846153846153,"[32, 1, 2, 3, 33, 34, 20, 21, 22, 26]",5,Floor-Division,there was number0 ml of tea in a pot . anna poured the tea into some cups . if there were number1 ml of tea in each cup,how many cups were filled with tea ?
453, number0 number1,nick saved $ number0 . if nick saved $ number1 more than lee how much did lee save ?,68.50 25.43,- number0 number1,43.07,"[1, 2, 3, 7, 8, 9, 10, 15, 16, 17]",4,Subtraction,nick saved $ number0 . if nick saved $ number1 more than lee,how much did lee save ?
454, dave number0 sara number1 money earn sara,dave earned $ number0 . sara earned $ number1 . how much more money did dave earn than sara ?,53.90 39.33,- number0 number1,14.57,"[1, 2, 3, 6, 7, 8, 16, 17, 18]",4,Difference,dave earned $ number0 . sara earned $ number1 .,how much more money did dave earn than sara ?
455, i number machine machine number0 number1 number number2 machine number put,i put another number into my machine . the machine added number0 and then subtracted number1 the number number2 came out of the machine . what number did i put in ?,15 6 35,- + number2 number1 number0,26.0,"[1, 4, 10, 11, 12, 14, 15, 16, 18, 19, 20, 28, 29, 30]",2,TVQ-Initial,i put another number into my machine . the machine added number0 and then subtracted number1 the number number2 came out of the machine .,what number did i put in ?
456, greg brad books time greg number0 pages day brad number1 pages day pages greg,greg and brad started reading their books at the same time . greg read number0 pages a day . brad read number1 pages a day . how many more pages did brad read than greg ?,18 26,- number1 number0,8.0,"[32, 1, 2, 33, 34, 6, 13, 14, 15, 20, 21, 22]",5,Difference,greg and brad started reading their books at the same time . greg read number0 pages a day . brad read number1 pages a day .,how many more pages did brad read than greg ?
457, cindy dan number stickers cindy number0 stickers dan number1 stickers stickers dan cindy,cindy and dan have the same number of stickers . cindy used number0 of her stickers . dan bought number1 more stickers . how many more stickers did dan have than cindy then ?,15 18,+ number0 number1,33.0,"[32, 1, 2, 3, 6, 11, 12, 13, 18, 19, 20, 21, 30, 31]",5,Addition,cindy and dan have the same number of stickers . cindy used number0 of her stickers . dan bought number1 more stickers .,how many more stickers did dan have than cindy then ?
458, rick todd number candy bars ate number0 candy bars todd number1 candy bars bars rick todd,rick and todd have the same number of candy bars . rick ate number0 candy bars . todd gave away number1 of his candy bars . how many more candy bars did rick have than todd then ?,11 18,- number1 number0,7.0,"[1, 2, 34, 35, 36, 7, 12, 13, 14, 15, 19, 20, 21]",5,Difference,rick and todd have the same number of candy bars . rick ate number0 candy bars . todd gave away number1 of his candy bars .,how many more candy bars did rick have than todd then ?
459, ed number0 marbles doug doug number1 marbles playground ed,ed had number0 more marbles than doug . doug lost number1 of his marbles at the playground . how many more marble did ed have than doug then ?,22 8,+ number0 number1,30.0,"[1, 2, 3, 4, 9, 10, 11, 25, 26, 27]",5,Addition,ed had number0 more marbles than doug . doug lost number1 of his marbles at the playground .,how many more marble did ed have than doug then ?
460, annette caitlin number0 pounds caitlin sara number1 pounds sara,annette and caitlin weigh number0 pounds together . caitlin and sara weigh number1 pounds together . how much more does annette weigh than sara ?,95 87,- number0 number1,8.0,"[3, 4, 5, 11, 12, 13, 21, 22, 23]",3,Difference,annette and caitlin weigh number0 pounds together . caitlin and sara weigh number1 pounds together .,how much more does annette weigh than sara ?
461, worm hole number0 inches number1 inches slides number2 inches day days worm top,a worm has fallen into a hole that is number0 inches deep . it climbs up number1 inches and slides back number2 inches every day . how many days will it take the worm to reach the top ?,26 8 3,/ number0 - number1 number2,5.2,"[1, 35, 36, 37, 6, 8, 9, 10, 15, 16, 17, 20, 21, 22, 23]",4,Floor-Division,a worm has fallen into a hole that is number0 inches deep . it climbs up number1 inches and slides back number2 inches every day .,how many days will it take the worm to reach the top ?
462, ice cream shop today number0 degrees number1 ice cream cones number2 milkshakes ice cream cones milkshakes,my ice cream shop was really busy today . it was number0 degrees and we sold number1 ice cream cones . we sold number2 more milkshakes than ice cream cones . how many milkshakes were sold ?,98 67 15,+ number1 number2,82.0,"[1, 33, 3, 34, 35, 6, 10, 11, 12, 15, 16, 17, 19, 22, 23, 24, 25]",3,Addition,my ice cream shop was really busy today . it was number0 degrees and we sold number1 ice cream cones . we sold number2 more milkshakes than ice cream cones .,how many milkshakes were sold ?
463, todd number0 cents pocket candy bar number1 cents box cookies number2 cents money,todd had number0 cents in his pocket . he bought a candy bar for number1 cents . he bought a box of cookies for number2 cents . how much money did todd spend altogether ?,85 14 39,+ number1 number2,53.0,"[32, 1, 2, 3, 33, 13, 14, 15, 23, 24, 25, 31]",3,Addition,todd had number0 cents in his pocket . he bought a candy bar for number1 cents . he bought a box of cookies for number2 cents .,how much money did todd spend altogether ?
464, league stadium number0 seats number1 people game today number2 people banners seats,the little league stadium has number0 seats . number1 people came to the game today . number2 people were holding banners . how many seats were empty ?,92 47 38,- number0 number1,45.0,"[1, 2, 3, 4, 5, 6, 8, 9, 16, 17, 24, 25, 26]",3,Subtraction,the little league stadium has number0 seats . number1 people came to the game today . number2 people were holding banners .,how many seats were empty ?
465, maura collects summer family beach house number0 days summer maura number1 seashells sister maura number2 seashells seashells sister,maura collects seashells every summer . her family stays at the beach house for number0 days . this summer maura found number1 seashells . she gave some to her little sister . maura then had number2 seashells . how many seashells did maura give to her sister ?,21 75 57,- number1 number2,18.0,"[1, 34, 3, 35, 36, 2, 5, 44, 13, 14, 15, 45, 46, 20, 21, 22]",3,Subtraction,maura collects seashells every summer . her family stays at the beach house for number0 days . this summer maura found number1 seashells . she gave some to her little sister . maura then had number2 seashells .,how many seashells did maura give to her sister ?
466, giraffe zoo number0 inches tall number1 adult giraffes zoo giraffe number2 inches taller giraffe,the tallest giraffe at the zoo is number0 inches tall . there are number1 adult giraffes at the zoo . the shortest giraffe is number2 inches . how much taller is the bigger giraffe ?,96 14 68,- number0 number2,28.0,"[32, 1, 33, 3, 6, 7, 8, 12, 13, 14, 15, 23, 24, 25, 31]",3,Subtraction,the tallest giraffe at the zoo is number0 inches tall . there are number1 adult giraffes at the zoo . the shortest giraffe is number2 inches .,how much taller is the bigger giraffe ?
467, city zoo number0 chimpanzees day chimps total number1 bananas week zoo number2 chimps cage chimps cage,the central city zoo has number0 chimpanzees . every day the chimps eat a total of number1 bananas . next week the zoo is moving number2 chimps to a new cage . how many chimps will stay in the old cage ?,45 72 18,- number0 number2,27.0,"[1, 4, 5, 6, 38, 8, 39, 40, 15, 16, 17, 24, 25, 26]",3,Subtraction,the central city zoo has number0 chimpanzees . every day the chimps eat a total of number1 bananas . next week the zoo is moving number2 chimps to a new cage .,how many chimps will stay in the old cage ?
468, zookeeper number0 penguins number1 penguins fish zoo number2 penguins penguins fish,the zookeeper has number0 fish to feed to the penguins . number1 penguins have already gotten a fish . the zoo has number2 penguins . how many more penguins need to get a fish ?,68 19 36,- number2 number1,17.0,"[32, 1, 2, 3, 4, 33, 6, 11, 12, 21, 22, 23, 31]",3,Subtraction,the zookeeper has number0 fish to feed to the penguins . number1 penguins have already gotten a fish . the zoo has number2 penguins .,how many more penguins need to get a fish ?
469, number0 zoo guide group number1 children guide group number2 children number3 guides zoo children zoo speak,number0 zoo guide spoke to a group of number1 children . another guide spoke to a group of number2 children . there are number3 guides at the zoo . how many children did the zoo guides speak to ?,1 19 25 22,+ number1 number2,44.0,"[0, 1, 2, 3, 35, 36, 37, 7, 8, 9, 17, 18, 19, 22, 23, 24]",3,Addition,number0 zoo guide spoke to a group of number1 children . another guide spoke to a group of number2 children . there are number3 guides at the zoo .,how many children did the zoo guides speak to ?
470, ralph photo album number0 pages number1 pictures animals ralph friend derrick number2 pictures animals pictures animals ralph,ralph has a photo album with number0 pages . he has number1 pictures of wild animals . ralph 's friend derrick has number2 pictures of wild animals . how many fewer pictures of wild animals does ralph have ?,50 26 34,- number2 number1,8.0,"[1, 2, 35, 4, 5, 6, 7, 36, 9, 10, 11, 12, 37, 21, 22, 23]",3,Subtraction,ralph has a photo album with number0 pages . he has number1 pictures of wild animals . ralph 's friend derrick has number2 pictures of wild animals .,how many fewer pictures of wild animals does ralph have ?
471, grade party number0 students number1 students boys number2 girls number3 students party students,lisa invited the entire third grade to her party . there are number0 students altogether . number1 of the students are boys and number2 are girls . number3 students will not be able to go to the party . how many students will be there ?,48 23 25 9,- number0 number3,39.0,"[1, 5, 42, 11, 12, 13, 43, 44, 16, 17, 22, 23, 24, 27, 28]",3,Subtraction,lisa invited the entire third grade to her party . there are number0 students altogether . number1 of the students are boys and number2 are girls . number3 students will not be able to go to the party .,how many students will be there ?
472, number0 songs music book names number1 guitar chords music book number2 songs songs,billy can play number0 songs in his music book . he knows the names of number1 different guitar chords . billy 's music book has number2 songs in it . how many songs does billy still need to learn ?,24 18 52,- number2 number0,28.0,"[1, 2, 3, 4, 36, 6, 37, 38, 14, 15, 16, 18, 24, 25, 26]",3,Subtraction,billy can play number0 songs in his music book . he knows the names of number1 different guitar chords . billy 's music book has number2 songs in it .,how many songs does billy still need to learn ?
473, mom number0 chocolate chip cookies number1 minutes ingredients number2 minutes julie ate number3 cookies dinner cookies,mom made number0 chocolate chip cookies . it took number1 minutes to mix the ingredients and number2 minutes to bake . julie and matt ate number3 cookies after dinner . how many cookies were left ?,32 24 16 9,- number0 number3,23.0,"[32, 1, 2, 3, 33, 5, 34, 8, 9, 10, 15, 16, 17, 24, 25, 26]",3,Subtraction,mom made number0 chocolate chip cookies . it took number1 minutes to mix the ingredients and number2 minutes to bake . julie and matt ate number3 cookies after dinner .,how many cookies were left ?
474, number0 questions math test number1 questions word problems number2 questions addition subtraction problems steve number3 questions questions blank,there are number0 questions on the math test . number1 questions are word problems . number2 questions are addition and subtraction problems . steve can only answer number3 questions . how many questions did steve leave blank ?,45 17 28 38,- number0 number3,7.0,"[1, 2, 3, 34, 5, 35, 36, 9, 10, 12, 15, 16, 21, 26, 27, 28]",3,Subtraction,there are number0 questions on the math test . number1 questions are word problems . number2 questions are addition and subtraction problems . steve can only answer number3 questions .,how many questions did steve leave blank ?
475, kendra number0 words week goal number1 words number2 birthday number3 words words,kendra learns number0 new spelling words each week . her goal is to learn number1 new words before her number2 birthday . she has already learned number3 new words . how many more words does kendra need to learn ?,12 60 8 36,- number1 number3,24.0,"[1, 2, 3, 4, 5, 6, 36, 37, 38, 13, 14, 15, 16, 18, 19, 20, 25, 26, 27, 28]",3,Subtraction,kendra learns number0 new spelling words each week . her goal is to learn number1 new words before her number2 birthday . she has already learned number3 new words .,how many more words does kendra need to learn ?
476, jake number0 pages book number1 chapters number2 pages jake number3 pages day pages,jake read number0 pages of his new book . it has number1 chapters and number2 pages . jake read number3 more pages later that day . how many pages has he read in all ?,37 8 95 25,+ number0 number3,62.0,"[32, 1, 2, 3, 33, 5, 10, 11, 12, 13, 14, 15, 18, 19, 20, 21, 31]",3,Addition,jake read number0 pages of his new book . it has number1 chapters and number2 pages . jake read number3 more pages later that day .,how many pages has he read in all ?
477, zoe vacation number0 pictures film number1 pictures zoe number2 pictures dolphin show pictures,zoe is on vacation . she has already taken number0 pictures . she has enough film left to take number1 more pictures . zoe took number2 more pictures at the dolphin show . how many pictures has zoe taken altogether ?,28 32 16,+ number0 number2,44.0,"[1, 3, 5, 6, 37, 8, 9, 10, 38, 39, 18, 19, 20, 21, 24, 25, 26, 27]",3,Addition,zoe is on vacation . she has already taken number0 pictures . she has enough film left to take number1 more pictures . zoe took number2 more pictures at the dolphin show .,how many pictures has zoe taken altogether ?
478, tripp charlotte number0 mile hike tripp backpack number1 pounds charlotte pack number2 pounds number3 miles day miles,tripp and charlotte are going on a number0 mile hike . tripp 's backpack weighs number1 pounds . charlotte 's back pack weighs number2 pounds less . they hiked number3 miles the first day . how many miles do they have left ?,36 25 7 9,- number0 number3,27.0,"[1, 3, 6, 7, 8, 39, 40, 41, 14, 15, 16, 22, 23, 24, 28, 29, 30]",3,Subtraction,tripp and charlotte are going on a number0 mile hike . tripp 's backpack weighs number1 pounds . charlotte 's back pack weighs number2 pounds less . they hiked number3 miles the first day .,how many miles do they have left ?
479, dora number0 birthday party saurday number1 people mom number2 sandwiches number3 people party people dora party,dora is having her number0 birthday party next saurday . she invited number1 people . her mom ordered number2 sandwiches . number3 people can not come to the party . how many people will be at dora 's party ?,10 64 36 16,- number1 number3,48.0,"[1, 2, 3, 4, 5, 6, 36, 8, 37, 38, 11, 12, 13, 17, 18, 19, 21, 22]",3,Subtraction,dora is having her number0 birthday party next saurday . she invited number1 people . her mom ordered number2 sandwiches . number3 people can not come to the party .,how many people will be at dora 's party ?
480, number0 pretzels bowl john ate number1 pretzels alan number2 pretzels john marcus ate number3 pretzels john pretzels eat,there are number0 pretzels in a bowl . john ate number1 pretzels . alan ate number2 fewer pretzels than john . marcus ate number3 more pretzels than john . how many pretzels did marcus eat ?,95 28 9 12,+ number1 number3,40.0,"[32, 1, 2, 3, 33, 5, 34, 9, 10, 11, 14, 15, 16, 17, 22, 23, 24, 25]",3,Addition,there are number0 pretzels in a bowl . john ate number1 pretzels . alan ate number2 fewer pretzels than john . marcus ate number3 more pretzels than john .,how many pretzels did marcus eat ?
481, number0 passengers bus number1 passengers stop number2 passengers stop passengers bus,there were number0 passengers on the bus . number1 passengers got off at the first stop . number2 passengers got off at the second stop . how many passengers were left on the bus ?,46 19 15,- - number0 number1 number2,12.0,"[32, 1, 2, 3, 33, 8, 9, 10, 17, 18, 31]",3,TVQ-Final,there were number0 passengers on the bus . number1 passengers got off at the first stop . number2 passengers got off at the second stop .,how many passengers were left on the bus ?
482, book store today number0 children story number1 people books number2 people checkout counter people bookstore,the book store is very busy today . there are number0 children listening to a story . number1 people are shopping for books . number2 people are at the checkout counter . how many people are at the bookstore ?,25 36 17,+ + number0 number1 number2,78.0,"[1, 3, 36, 37, 6, 38, 9, 10, 11, 17, 18, 24, 25]",3,Sum,the book store is very busy today . there are number0 children listening to a story . number1 people are shopping for books . number2 people are at the checkout counter .,how many people are at the bookstore ?
483, alexa nancy mystery number0 pages book number1 pages day day reading number2 pages pages alexa,alexa is reading a nancy drew mystery . there are number0 pages in her book . she read number1 pages the first day . the next day alexa just could n't stop reading . she read number2 pages . how many pages does alexa have left to read ?,95 18 58,- - number0 number1 number2,19.0,"[1, 35, 36, 37, 6, 9, 10, 11, 45, 46, 47, 17, 18, 19]",3,TVQ-Final,alexa is reading a nancy drew mystery . there are number0 pages in her book . she read number1 pages the first day . the next day alexa just could n't stop reading . she read number2 pages .,how many pages does alexa have left to read ?
484, sam number0 pretzels bowl party friends number1 sam number2 pretzels pretzels bowl,sam put number0 pretzels in a bowl for the party . his friends ate number1 of them . sam put in number2 more pretzels . how many pretzels were in the bowl then ?,86 49 27,+ - number0 number1 number2,64.0,"[32, 1, 2, 3, 4, 6, 13, 14, 15, 20, 21, 22, 23, 30, 31]",3,TVQ-Final,sam put number0 pretzels in a bowl for the party . his friends ate number1 of them . sam put in number2 more pretzels .,how many pretzels were in the bowl then ?
485, tommy number0 number1 camera number2 cd player money,tommy has $ number0 . he wants to buy a $ number1 camera . he also wants to buy a $ number2 cd player . how much more money does tommy need ?,79 35 59,- + number1 number2 number0,15.0,"[1, 2, 3, 10, 11, 12, 20, 21, 22, 29, 30, 31]",3,TVQ-Change,tommy has $ number0 . he wants to buy a $ number1 camera . he also wants to buy a $ number2 cd player .,how much more money does tommy need ?
486, omar loves checkers number0 games yesterday number1 games today omar number2 games games,omar loves to play checkers . he played number0 games yesterday . he played number1 games today . omar lost number2 games . how many games did he win ?,37 49 18,- + number0 number1 number2,68.0,"[1, 5, 7, 8, 9, 13, 14, 15, 19, 20, 21, 26, 27, 28]",3,TVQ-Change,omar loves to play checkers . he played number0 games yesterday . he played number1 games today . omar lost number2 games .,how many games did he win ?
487, number0 students computer classes number1 graders number2 graders rest students number3 graders number4 graders computer classes,number0 students signed up for computer classes . there were number1 second graders and number2 third graders . the rest of the students were number3 graders . how many number4 graders took computer classes ?,94 24 29 4 4,- - number0 number1 number2,41.0,"[0, 1, 2, 3, 4, 7, 9, 10, 11, 12, 13, 14, 15, 16, 23, 24, 25, 28, 29, 30, 31, 32, 33]",3,TVQ-Final,number0 students signed up for computer classes . there were number1 second graders and number2 third graders . the rest of the students were number3 graders .,how many number4 graders took computer classes ?
488, j.t superhero trading cards number0 number1 friend number2 cards cards j.t,j.t . has some superhero trading cards . he lost number0 of them . he gave number1 of them to his best friend . now he has number2 cards left . how many cards did j.t . have at first ?,14 19 45,+ + number2 number0 number1,78.0,"[1, 2, 3, 37, 38, 39, 9, 10, 11, 15, 16, 17, 26, 27, 28]",3,TVQ-Initial,j.t . has some superhero trading cards . he lost number0 of them . he gave number1 of them to his best friend . now he has number2 cards left .,how many cards did j.t . have at first ?
489, evan collection books friend number0 books brother number1 books number2 books collection books,evan has a large collection of books . he gave his best friend number0 books . he gave his little brother number1 books . now evan has number2 books in his collection . how many books did he have at first ?,14 8 60,+ + number2 number0 number1,82.0,"[1, 2, 5, 38, 39, 40, 12, 13, 14, 20, 21, 22, 26, 27, 28]",3,TVQ-Initial,evan has a large collection of books . he gave his best friend number0 books . he gave his little brother number1 books . now evan has number2 books in his collection .,how many books did he have at first ?
490, number0 miles house mr. number1 miles pie dessert number2 miles gas car miles grandma house,it is number0 miles to grandma 's house . mr. welch drove number1 miles . he stopped to buy a pie for dessert . then he drove number2 miles and stopped to put gas in the car . how many more miles until he reaches grandma 's house ?,78 35 18,- - number0 number1 number2,25.0,"[1, 2, 3, 6, 11, 12, 13, 45, 46, 47, 26, 27, 28]",3,TVQ-Final,it is number0 miles to grandma 's house . mr. welch drove number1 miles . he stopped to buy a pie for dessert . then he drove number2 miles and stopped to put gas in the car .,how many more miles until he reaches grandma 's house ?
