,Question,orig_Question,Numbers,Equation,Answer,group_nums,Grade,Type,Body,Ques_Statement
705, number0 rides day number1 rides day times,at the fair dave rode number0 rides the first day he went and number1 rides the second day . how many times did he ride total ?,4 3,+ number0 number1,7.0,"[4, 5, 6, 12, 13, 14, 23, 24, 25]",4,Addition,at the fair dave rode number0 rides the first day he went and number1 rides the second day .,how many times did he ride total ?
706, janet marathon number0 days number1 miles day miles janet,janet was practicing for a marathon . she practiced for number0 days running number1 miles each day . how many miles did janet run altogether ?,9 8,* number0 number1,72.0,"[1, 5, 9, 10, 11, 12, 13, 14, 15, 22, 23, 24]",4,Multiplication,janet was practicing for a marathon . she practiced for number0 days running number1 miles each day .,how many miles did janet run altogether ?
707, edward basketball friend number0 points number1 points points friend score,edward was playing basketball with his friend . together they scored number0 points . if edward scored number1 of the points . how many points did his friend score ?,13 7,- number0 number1,6.0,"[1, 2, 6, 10, 11, 12, 16, 17, 18, 26, 27, 28]",4,Subtraction,edward was playing basketball with his friend . together they scored number0 points . if edward scored number1 of the points .,how many points did his friend score ?
708, tiffany hand towels house number0 packs pack number1 towels towels,tiffany was buying hand towels for her house . she bought number0 packs with each pack having number1 towels in it . how many towels did she buy ?,9 3,* number0 number1,27.0,"[1, 2, 5, 7, 10, 11, 12, 14, 16, 17, 18, 25, 26, 27]",4,Multiplication,tiffany was buying hand towels for her house . she bought number0 packs with each pack having number1 towels in it .,how many towels did she buy ?
709, debby change stacks number0 stack number1 coins number2 coins,debby was placing her spare change into stacks . number0 stack had number1 coins and the other had number2 how many coins did she have total ?,1 4 8,+ number1 number2,12.0,"[1, 2, 5, 9, 10, 11, 12, 13, 17, 18, 19, 23, 24, 25]",4,Addition,debby was placing her spare change into stacks . number0 stack had number1 coins and the other had number2 how,many coins did she have total ?
710, faye number0 phone space number1 apps apps,faye had number0 apps on her phone . to free up some space she deleted number1 of the apps . how many apps did she have left ?,12 8,- number0 number1,4.0,"[1, 2, 3, 6, 14, 15, 16, 24, 25, 26]",4,Subtraction,faye had number0 apps on her phone . to free up some space she deleted number1 of the apps .,how many apps did she have left ?
711, bianca marathon number0 miles day number1 miles day miles,bianca was practicing for a marathon . to prepare she ran number0 miles the first day and number1 miles the next day . how many miles did bianca run altogether ?,8 4,+ number0 number1,12.0,"[1, 3, 5, 10, 11, 12, 16, 17, 18, 27, 28, 29]",4,Addition,bianca was practicing for a marathon . to prepare she ran number0 miles the first day and number1 miles the next day .,how many miles did bianca run altogether ?
712, jerry number0 action figures shelf room number1 figures shelf action figures shelf total,jerry had number0 action figures on a shelf in his room . later he added number1 more figures to the shelf . how many action figures were on his shelf total ?,8 2,+ number0 number1,10.0,"[1, 2, 3, 4, 8, 14, 15, 16, 17, 28, 29, 30]",4,Addition,jerry had number0 action figures on a shelf in his room . later he added number1 more figures to the shelf .,how many action figures were on his shelf total ?
713, sarah number0 shirts school number1 shirts,sarah bought number0 new shirts for school . if she already had number1 shirts how many did she own total ?,8 9,+ number0 number1,17.0,"[1, 2, 3, 4, 11, 12, 13, 17, 18, 19]",4,Addition,sarah bought number0 new shirts for school . if she already had number1 shirts,how many did she own total ?
714, books astronomy number0 books planets number1 space program books,ned was buying books about astronomy . he bought number0 books about the planets and number1 about the space program . how many books did he buy total ?,8 4,+ number0 number1,12.0,"[1, 2, 5, 8, 9, 10, 14, 15, 16, 25, 26, 27]",4,Addition,ned was buying books about astronomy . he bought number0 books about the planets and number1 about the space program .,how many books did he buy total ?
715, delivery driver number0 stops route deliveries number1 stops stops,a delivery driver had to make number0 stops on his route . after he finished those deliveries he made number1 more stops . how many stops did he make total ?,3 4,+ number0 number1,7.0,"[1, 5, 6, 7, 8, 18, 19, 20, 21, 27, 28, 29]",4,Addition,a delivery driver had to make number0 stops on his route . after he finished those deliveries he made number1 more stops .,how many stops did he make total ?
716, mom school supplies sister number0 packs glue sticks number1 packs sister get,emily 's mom was buying extra school supplies for emily and her sister . she bought number0 packs of glue sticks total . if she gave emily number1 packs how many did her sister get ?,13 6,- number0 number1,7.0,"[32, 1, 2, 33, 34, 15, 16, 17, 26, 27, 28]",4,Subtraction,emily 's mom was buying extra school supplies for emily and her sister . she bought number0 packs of glue sticks total . if she gave emily number1 packs,how many did her sister get ?
717, roger book series number0 books number1 books week weeks series,roger was reading through his favorite book series . he had number0 books to read total . if he read number1 books each week how many weeks would it take him to finish the series ?,30 6,/ number0 number1,5.0,"[32, 1, 2, 33, 34, 10, 11, 12, 19, 20, 21, 22]",4,Common-Division,roger was reading through his favorite book series . he had number0 books to read total . if he read number1 books each week,how many weeks would it take him to finish the series ?
718, rachel number0 pages math homework number1 pages homework pages total,rachel had to complete number0 pages of math homework and number1 pages of reading homework . how many pages did she have to complete total ?,9 2,+ number0 number1,11.0,"[1, 3, 4, 5, 7, 9, 10, 11, 22, 23, 24]",4,Addition,rachel had to complete number0 pages of math homework and number1 pages of reading homework .,how many pages did she have to complete total ?
719, haley number0 cans number1 cans number2 bag cans,haley collected number0 cans for recycling . if she put number1 cans in number2 bag how many cans did she have left ?,9 7 1,- number0 number1,2.0,"[1, 2, 3, 9, 10, 11, 12, 13, 14, 19, 20, 21]",4,Subtraction,haley collected number0 cans for recycling . if she put number1 cans in number2 bag,how many cans did she have left ?
720, amy soups number0 cans chicken soup number1 cans tomato soup soups,amy was buying different soups . she bought number0 cans of chicken soup and number1 cans of tomato soup . how many soups did she buy ?,6 3,+ number0 number1,9.0,"[1, 7, 8, 9, 13, 14, 15, 23, 24, 25]",4,Addition,amy was buying different soups . she bought number0 cans of chicken soup and number1 cans of tomato soup .,how many soups did she buy ?
721, vase number0 flowers number1 flowers vases,a vase can hold number0 flowers . if you had number1 flowers how many vases would you need ?,5 25,/ number1 number0,5.0,"[2, 3, 4, 5, 9, 10, 11, 15, 16, 17]",4,Common-Division,a vase can hold number0 flowers . if you had number1 flowers,how many vases would you need ?
722, adam book series week number0 books week number1 books books,adam was reading through his favorite book series . the first week he read number0 different books . the next week he read number1 books . how many books did he read total ?,5 8,+ number0 number1,13.0,"[32, 1, 4, 5, 6, 13, 14, 15, 16, 22, 23, 24, 30, 31]",4,Addition,adam was reading through his favorite book series . the first week he read number0 different books . the next week he read number1 books .,how many books did he read total ?
723, paige dresser drawers number0 pieces clothing number1 drawers pieces clothing,paige 's dresser drawers could hold number0 pieces of clothing each . if she had number1 drawers how many pieces of clothing could it hold ?,2 4,* number0 number1,8.0,"[2, 5, 6, 7, 10, 12, 14, 15, 16, 22, 23, 24]",4,Multiplication,paige 's dresser drawers could hold number0 pieces of clothing each . if she had number1 drawers,how many pieces of clothing could it hold ?
724, architect hotel downtown number0 stories number1 rooms story rooms hotel,an architect was building a hotel downtown . he built it number0 stories tall with number1 rooms on each story . how many rooms does the hotel have totaled ?,3 8,* number0 number1,24.0,"[1, 7, 10, 11, 12, 14, 15, 16, 18, 26, 27, 28]",4,Multiplication,an architect was building a hotel downtown . he built it number0 stories tall with number1 rooms on each story .,how many rooms does the hotel have totaled ?
725, isabel number0 dollars birthday toys cost number1 dollars toys,isabel received number0 dollars for her birthday . later she found some toys that cost number1 dollars each . how many of the toys could she buy ?,14 2,/ number0 number1,7.0,"[1, 2, 3, 6, 14, 15, 16, 17, 24, 25, 26]",4,Common-Division,isabel received number0 dollars for her birthday . later she found some toys that cost number1 dollars each .,how many of the toys could she buy ?
726, number0 students class teacher groups number1 students group groups,there are number0 students in a class . if the teacher put them into groups with number1 students in each group how many groups would she have ?,30 5,/ number0 number1,6.0,"[1, 2, 3, 15, 16, 17, 19, 24, 25, 26]",4,Common-Division,there are number0 students in a class . if the teacher put them into groups with number1 students in each group,how many groups would she have ?
727, haley mom school supplies haley sister number0 reams paper haley number1 reams,haley 's mom was buying extra school supplies for haley and her sister . if she bought number0 reams of paper for haley and number1 reams for her sister how many did she buy total ?,2 3,+ number0 number1,5.0,"[32, 33, 2, 34, 16, 17, 18, 23, 24, 25]",4,Addition,haley 's mom was buying extra school supplies for haley and her sister . if she bought number0 reams of paper for haley and number1 reams for her sister,how many did she buy total ?
728, number0 students school band band instructor students rows number1 students row rows,there are number0 students in the school band . if the band instructor put the students into rows with number1 students in each row how many rows could he make ?,40 5,/ number0 number1,8.0,"[1, 2, 3, 4, 18, 19, 20, 22, 27, 28, 29]",4,Common-Division,there are number0 students in the school band . if the band instructor put the students into rows with number1 students in each row,how many rows could he make ?
729, roger lawn number0 times spring summer number1 times summer times spring,roger mowed his lawn number0 times total during the spring and summer . if he mowed it number1 times in the summer . how many times did he mow in the spring ?,15 9,- number0 number1,6.0,"[1, 3, 4, 5, 16, 17, 18, 29, 30, 31]",4,Subtraction,roger mowed his lawn number0 times total during the spring and summer . if he mowed it number1 times in the summer .,how many times did he mow in the spring ?
730, robin number0 sodas friends number1 extras,robin bought number0 sodas for her and her friends . if they only drank number1 of them how many extras did she have ?,11 3,- number0 number1,8.0,"[1, 2, 3, 13, 14, 15, 20, 21, 22]",4,Subtraction,robin bought number0 sodas for her and her friends . if they only drank number1 of them,how many extras did she have ?
731, architect number0 story house floor house number1 bedrooms floor number2 bedrooms bedrooms house,an architect was building his number0 story house . on the first floor the house had number1 bedrooms and the second floor had number2 bedrooms . how many bedrooms does the house have totaled ?,2 6 4,+ number1 number2,10.0,"[32, 1, 33, 4, 5, 6, 7, 15, 16, 17, 22, 23, 24, 31]",4,Addition,an architect was building his number0 story house . on the first floor the house had number1 bedrooms and the second floor had number2 bedrooms .,how many bedrooms does the house have totaled ?
732, carol invitations friends package invitations number0 invitations number1 friends,carol was sending out birthday invitations to her friends . if each package of invitations she bought had number0 invitations in it and she bought number1 packs how many friends can she invite ?,9 5,* number0 number1,45.0,"[32, 2, 7, 11, 14, 17, 18, 19, 24, 25, 26, 30, 31]",4,Multiplication,carol was sending out birthday invitations to her friends . if each package of invitations she bought had number0 invitations in it and she bought number1 packs,how many friends can she invite ?
733, designer furniture house number0 chairs living room number1 kitchen chairs,a designer was buying furniture for her new house . she bought number0 chairs for the living room and number1 for her kitchen . how many chairs did she buy total ?,3 6,+ number0 number1,9.0,"[1, 5, 11, 12, 13, 18, 19, 20, 28, 29, 30]",4,Addition,a designer was buying furniture for her new house . she bought number0 chairs for the living room and number1 for her kitchen .,how many chairs did she buy total ?
734, pet store number0 snakes snakes cages number1 snakes cage cages pet store,a pet store had number0 snakes . they had the snakes in cages with number1 snakes in each cage . how many cages did the pet store have ?,4 2,/ number0 number1,2.0,"[1, 3, 4, 5, 13, 14, 15, 17, 25, 26, 27]",4,Common-Division,a pet store had number0 snakes . they had the snakes in cages with number1 snakes in each cage .,how many cages did the pet store have ?
735, john party number0 people number1 people costumes,john threw a halloween party where number0 people showed up . if only number1 dressed up how many people did n't wear costumes ?,13 6,- number0 number1,7.0,"[5, 6, 7, 8, 10, 12, 13, 14, 20, 21, 22]",4,Subtraction,john threw a halloween party where number0 people showed up . if only number1 dressed up,how many people did n't wear costumes ?
736, oliver sale shopping number0 video games number1 games,oliver was yard sale shopping . he ended up buying number0 video games but only number1 of them worked . how many bad games did he buy ?,11 6,- number0 number1,5.0,"[1, 2, 3, 6, 9, 10, 11, 12, 14, 15, 16, 24, 25, 26]",4,Subtraction,oliver was yard sale shopping . he ended up buying number0 video games but only number1 of them worked .,how many bad games did he buy ?
737, pet store number0 cage number1 birds cage,a pet store took number0 birds out of a cage and had number1 still left inside . how many birds were in the cage to start with ?,10 9,+ number0 number1,19.0,"[1, 3, 4, 5, 6, 11, 12, 13, 24, 25, 26]",1,Addition,a pet store took number0 birds out of a cage and had number1 still left inside .,how many birds were in the cage to start with ?
738, rachel number0 apples tree tree number1 apples apples tree,rachel picked number0 apples from her tree . now the tree has number1 apples still on it . how many apples did the tree have to begin with ?,3 4,+ number0 number1,7.0,"[1, 2, 3, 8, 11, 12, 13, 25, 26, 27]",1,Addition,rachel picked number0 apples from her tree . now the tree has number1 apples still on it .,how many apples did the tree have to begin with ?
739, paige number0 goldfish pond cats number1 goldfish,paige raised number0 goldfish in the pond but stray cats loved eating them . now she has number1 left . how many goldfish disappeared ?,15 4,- number0 number1,11.0,"[1, 2, 3, 16, 17, 18, 21, 22, 23]",1,Subtraction,paige raised number0 goldfish in the pond but stray cats loved eating them . now she has number1 left .,how many goldfish disappeared ?
740, cody number0 dumplings number1 dumplings cody,cody cooked number0 dumplings . he ate number1 . how many dumplings does cody have now ?,14 7,- number0 number1,7.0,"[1, 2, 3, 5, 6, 7, 13, 14, 15]",1,Subtraction,cody cooked number0 dumplings . he ate number1 .,how many dumplings does cody have now ?
741, sarah number0 text messages day number1 messages,sarah could send number0 text messages a day . if she sent number1 how many text messages does she have left she can send ?,10 8,- number0 number1,2.0,"[2, 3, 4, 5, 11, 12, 13, 21, 22, 23]",1,Subtraction,sarah could send number0 text messages a day . if she sent number1,how many text messages does she have left she can send ?
742, debby number0 pieces candy number1 pieces pieces eat,debby had number0 pieces of candy . after eating some she had number1 pieces . how many pieces did debby eat ?,12 3,- number0 number1,9.0,"[1, 2, 3, 4, 5, 11, 12, 13, 18, 19, 20]",1,Subtraction,debby had number0 pieces of candy . after eating some she had number1 pieces .,how many pieces did debby eat ?
743, frank number0 toys number1 left toys,frank had $ number0 . after buying some new toys he had $ number1 left . how much did he spend on toys ?,16 8,- number0 number1,8.0,"[1, 2, 3, 11, 12, 13, 14, 20, 21, 22]",1,Subtraction,frank had $ number0 . after buying some new toys he had $ number1 left .,how much did he spend on toys ?
744, robin hair number0 inches number1 inches hair,robin 's hair was number0 inches long . if she cut off number1 inches how long is her hair now ?,15 5,- number0 number1,10.0,"[2, 3, 4, 5, 11, 12, 13, 17, 18, 19]",1,Subtraction,robin 's hair was number0 inches long . if she cut off number1 inches,how long is her hair now ?
745, megan number0 number1 rides money,at the fair megan had $ number0 to spend . she spent $ number1 on rides . how much money does she have left ?,17 6,- number0 number1,11.0,"[1, 4, 5, 6, 7, 12, 13, 14, 21, 22, 23]",1,Subtraction,at the fair megan had $ number0 to spend . she spent $ number1 on rides .,how much money does she have left ?
746, number0 kinds sandwiches menu number1 kinds sandwiches,there were number0 kinds of sandwiches on the menu . unfortunately number1 of them had been sold out how many kinds of sandwiches do they actually provide now ?,9 5,- number0 number1,4.0,"[1, 2, 3, 9, 10, 11, 12, 16, 25, 26, 27]",1,Subtraction,there were number0 kinds of sandwiches on the menu . unfortunately number1 of them had been sold out,how many kinds of sandwiches do they actually provide now ?
747, chef number0 apples pie number1 left apples pie,a chef had number0 apples . after making a pie he had number1 left . how many apples did he use in the pie ?,16 7,- number0 number1,9.0,"[1, 2, 3, 4, 5, 11, 12, 13, 21, 22, 23]",1,Subtraction,a chef had number0 apples . after making a pie he had number1 left .,how many apples did he use in the pie ?
748, book fair number0 posters number1 posters posters,the book fair sold number0 posters . now they have number1 posters left . how many posters did they have to begin with ?,4 2,+ number0 number1,6.0,"[1, 2, 3, 4, 5, 7, 9, 10, 11, 20, 21, 22]",1,Addition,the book fair sold number0 posters . now they have number1 posters left .,how many posters did they have to begin with ?
749, pizzas party party number0 number1 pizzas order party,ned ordered some pizzas for a party . during the party number0 were eaten . now he has number1 left . how many pizzas did ned order for the party ?,4 7,+ number0 number1,11.0,"[10, 11, 12, 17, 18, 19, 27, 28, 29]",1,Addition,ned ordered some pizzas for a party . during the party number0 were eaten . now he has number1 left .,how many pizzas did ned order for the party ?
750, baker number0 cakes number1 cakes cakes baker,a baker sold number0 cakes . now he has number1 cakes . how many cakes did the baker have to start with ?,12 3,+ number0 number1,15.0,"[1, 2, 3, 4, 8, 9, 10, 19, 20, 21]",1,Addition,a baker sold number0 cakes . now he has number1 cakes .,how many cakes did the baker have to start with ?
751, jerry number0 number1 video games money,jerry had $ number0 . he spent $ number1 on new video games . how much money does he have now ?,18 6,- number0 number1,12.0,"[1, 2, 3, 6, 7, 8, 9, 18, 19, 20]",1,Subtraction,jerry had $ number0 . he spent $ number1 on new video games .,how much money does he have now ?
752, dave number0 apps phone number1 left,dave had number0 apps on his phone . after deleting some he had number1 left . how many apps did he delete ?,16 8,- number0 number1,8.0,"[1, 2, 3, 4, 5, 12, 13, 14, 19, 20, 21]",1,Subtraction,dave had number0 apps on his phone . after deleting some he had number1 left .,how many apps did he delete ?
753, isabel number0 bottles water week number1 left,isabel had number0 bottles of water . after a week she had number1 left . how many did she drink ?,16 7,- number0 number1,9.0,"[1, 2, 3, 4, 11, 12, 13, 17, 18, 19]",1,Subtraction,isabel had number0 bottles of water . after a week she had number1 left .,how many did she drink ?
754, waiter number0 customers number1 customers waiter,a waiter had number0 customers . if number1 left how many customers would the waiter still have ?,18 6,- number0 number1,12.0,"[2, 3, 4, 6, 7, 8, 10, 14, 15, 16]",1,Subtraction,a waiter had number0 customers . if number1 left,how many customers would the waiter still have ?
755, megan number0 bottles water number1 bottles,megan had number0 bottles of water . if she drank number1 of them how many bottles would megan have left ?,17 3,- number0 number1,14.0,"[1, 2, 3, 7, 9, 10, 11, 12, 17, 18, 19]",1,Subtraction,megan had number0 bottles of water . if she drank number1 of them,how many bottles would megan have left ?
756, jenny room number0 days friend birthday party number1 days jenny room days,jenny was told to clean up her room in number0 days or she could not go to her best friend 's birthday party . it is number1 days left but jenny has cleaned up her room . how many days did she spend ?,14 3,- number0 number1,11.0,"[1, 5, 8, 9, 10, 40, 41, 42, 25, 26, 27]",1,Subtraction,jenny was told to clean up her room in number0 days or she could not go to her best friend 's birthday party . it is number1 days left but jenny has cleaned up her room .,how many days did she spend ?
757, maria number0 tank number1 fish tank fish tank,maria took number0 fish out of her fish tank . now there are number1 fish in the tank . how many fish were in the tank to start with ?,16 3,+ number0 number1,19.0,"[1, 2, 3, 6, 12, 13, 14, 26, 27, 28]",1,Addition,maria took number0 fish out of her fish tank . now there are number1 fish in the tank .,how many fish were in the tank to start with ?
758, waiter number0 customers number1 customers customers,a waiter had number0 customers . after some left he still had number1 customers . how many customers left ?,14 3,- number0 number1,11.0,"[1, 2, 3, 4, 5, 11, 12, 13, 16, 17, 18]",1,Subtraction,a waiter had number0 customers . after some left he still had number1 customers .,how many customers left ?
759, cody bag marbles number0 brother cody number1 marbles marbles cody,cody had a bag of marbles . later he gave number0 to his brother . now cody has number1 marbles . how many marbles did cody have to start with ?,5 7,+ number0 number1,12.0,"[1, 2, 7, 9, 10, 11, 17, 18, 19, 27, 28, 29]",1,Addition,cody had a bag of marbles . later he gave number0 to his brother . now cody has number1 marbles .,how many marbles did cody have to start with ?
760, museum number0 paintings number1 pictures,a museum had number0 paintings . if they got rid of number1 of them how many pictures would they have left ?,13 8,- number0 number1,5.0,"[2, 3, 4, 10, 11, 12, 18, 19, 20]",1,Subtraction,a museum had number0 paintings . if they got rid of number1 of them,how many pictures would they have left ?
761, chef number0 apples pie number1 apples apples pie,a chef used number0 apples to make a pie . now he has number1 apples left . how many apples did he have before he made the pie ?,15 4,+ number0 number1,19.0,"[1, 2, 3, 4, 5, 12, 13, 14, 25, 26, 27]",1,Addition,a chef used number0 apples to make a pie . now he has number1 apples left .,how many apples did he have before he made the pie ?
762, megan number0 acorns sister number1 acorns acorns megan beginning,megan gave number0 acorns to her sister . now megan has number1 acorns left . how many acorns did megan have in the beginning ?,7 9,+ number0 number1,16.0,"[1, 2, 3, 5, 10, 11, 12, 21, 22, 23]",1,Addition,megan gave number0 acorns to her sister . now megan has number1 acorns left .,how many acorns did megan have in the beginning ?
763, halloween number0 pounds candy number1 pounds pounds,for halloween will got number0 pounds of candy . after giving some to haley he had number1 pounds left . how many pounds did he give to haley ?,15 9,- number0 number1,6.0,"[1, 3, 4, 5, 6, 15, 16, 17, 25, 26, 27]",1,Subtraction,for halloween will got number0 pounds of candy . after giving some to haley he had number1 pounds left .,how many pounds did he give to haley ?
764, amy number0 pencils number1,amy had number0 pencils . if she used number1 of them how many would she have left ?,12 4,- number0 number1,8.0,"[1, 2, 3, 7, 8, 9, 14, 15, 16]",1,Subtraction,amy had number0 pencils . if she used number1 of them,how many would she have left ?
765, victor number0 apps phone number1 apps victor,victor had number0 apps on his phone . he deleted number1 of them . how many apps does victor have left ?,19 8,- number0 number1,11.0,"[1, 2, 3, 6, 9, 10, 11, 18, 19, 20]",1,Subtraction,victor had number0 apps on his phone . he deleted number1 of them .,how many apps does victor have left ?
766, number0 number1 money,edward spent $ number0 . now he has $ number1 . how much did edward have before he spent his money ?,13 6,+ number0 number1,19.0,"[1, 2, 3, 7, 8, 9, 18, 19, 20]",1,Addition,edward spent $ number0 . now he has $ number1 .,how much did edward have before he spent his money ?
