,Question,orig_Question,Numbers,Equation,Answer,group_nums,Grade,Type,Body,Ques_Statement
207, music store set speakers dad entertainment system price speakers number0 number1 money discount,lastly he went to a music store and bought a new set of speakers for his dad 's entertainment system . if the initial price of the speakers is $ number0 he got it for $ number1 how much money was he able to save from having a discount ?,475.00 199.00,- number0 number1,276.0,"[35, 36, 37, 46, 47, 48, 29, 30, 31]",3,Subtraction,lastly he went to a music store and bought a new set of speakers for his dad 's entertainment system . if the initial price of the speakers is $ number0 he got it for $ number1,how much money was he able to save from having a discount ?
208, total number0 gifts total number1 money giftwrapping expenses,if he spent a total of $ number0 and all the gifts cost a total of $ number1 how much money did he spend on giftwrapping and other expenses ?,700.00 561.00,- number0 number1,139.0,"[6, 7, 8, 16, 17, 18, 26, 27, 28]",3,Subtraction,if he spent a total of $ number0 and all the gifts cost a total of $ number1,how much money did he spend on giftwrapping and other expenses ?
209, janine catering service company mayor number0 birthday appetizers number1 mini meat pies crew number2 teams team number3 number4 pies team make,janine owns a catering service company . she was hired to cater for the mayor 's number0 birthday . for the appetizers she needs to make number1 mini meat pies . she divided her crew into number2 teams . if the first team made number3 and the second made number4 how many pies should the third team make ?,50 750 3 235 275,- number1 + number3 number4,240.0,"[35, 36, 37, 43, 44, 45, 12, 48, 49, 50, 18, 55, 56, 25, 26, 27, 29, 57]",3,Subtraction,janine owns a catering service company . she was hired to cater for the mayor 's number0 birthday . for the appetizers she needs to make number1 mini meat pies . she divided her crew into number2 teams . if the first team made number3 and the second made number4,how many pies should the third team make ?
210, food item number0 cups mushroom soup team number1 cups team number2 cups team prepare order amount soup,next food item she has to prepare is soup . she needs number0 cups of mushroom soup . if the first team made number1 cups and the third team made number2 cups how any cups should the second team prepare in order to meet the required amount of soup ?,280 90 70,- number0 + number1 number2,120.0,"[1, 4, 11, 12, 13, 46, 47, 48, 21, 22, 23, 24, 29, 30, 31]",3,Subtraction,next food item she has to prepare is soup . she needs number0 cups of mushroom soup . if the first team made number1 cups and the third team made number2 cups,how any cups should the second team prepare in order to meet the required amount of soup ?
211, course number0 pieces fillets team number1 pieces team number2 pieces pieces team make,for the second main course they were asked to make number0 pieces of fish fillets . if the first team made number1 pieces and the second team made number2 pieces how many pieces should the third team make ?,500 189 131,- number0 + number1 number2,180.0,"[35, 4, 36, 37, 9, 10, 11, 15, 20, 21, 22, 27, 28, 29]",3,Subtraction,for the second main course they were asked to make number0 pieces of fish fillets . if the first team made number1 pieces and the second team made number2 pieces,how many pieces should the third team make ?
212, total number0 adults number1 children number2 people,they served a total of number0 adults and number1 children if number2 of all the people they served are male how many are female ?,179 141 156,- + number0 number1 number2,164.0,"[4, 5, 6, 7, 8, 9, 10, 11, 12, 21, 22, 23]",3,Subtraction,they served a total of number0 adults and number1 children if number2 of all the people they served are male,how many are female ?
213, alvin house forest place wood blueprint number0 pieces wood friend number1 pieces brother number2 pieces wood,alvin is trying to build a small house in the forest so that he has a place to stay whenever he goes hunting . he started by gathering some wood . according to his blueprint he will need number0 pieces of wood . if his friend gave him number1 pieces and his brother gave him number2 pieces how many more wood does he need to gather ?,376 123 136,- - number0 number1 number2,117.0,"[64, 65, 3, 37, 38, 39, 6, 10, 47, 48, 49, 54, 55, 56, 63]",3,TVQ-Change,alvin is trying to build a small house in the forest so that he has a place to stay whenever he goes hunting . he started by gathering some wood . according to his blueprint he will need number0 pieces of wood . if his friend gave him number1 pieces and his brother gave him number2 pieces,how many more wood does he need to gather ?
214, nails number0 nails number1 nails total number2 nails,he also needed some nails . if he already has number0 nails with him and he found another number1 in his toolshed how many more nails does he need to buy if he needs a total of number2 nails ?,247 144 500,- number2 + number0 number1,109.0,"[2, 3, 36, 37, 38, 9, 10, 11, 17, 18, 19, 24]",3,Subtraction,he also needed some nails . if he already has number0 nails with him and he found another number1 in his toolshed,how many more nails does he need to buy if he needs a total of number2 nails ?
215, support house connections wood joints rope number0 feet rope number1 feet rope moment number2 feet feet rope friends,to add support on the house 's connections he decided to tie the wood joints with rope . he needs number0 feet of rope . if he has number1 feet of rope with him and at the moment he only needed number2 feet how many feet of rope did his friends give to him ?,185 46 57,- number0 + number2 number1,82.0,"[1, 2, 40, 41, 42, 15, 19, 20, 21, 51, 52, 53, 26, 27, 28, 29]",3,Subtraction,to add support on the house 's connections he decided to tie the wood joints with rope . he needs number0 feet of rope . if he has number1 feet of rope with him and at the moment he only needed number2 feet,how many feet of rope did his friends give to him ?
216, evenings forest fireplace cement number0 lbs cement son number1 cement number2 lbs,he wanted to make sure that he is protected from the cold evenings in the forest so he decided to build a fireplace made of cement . if he bought number0 lbs of cement and his son brought another number1 lbs how much cement did he have originally if he now has number2 lbs ?,215 137 450,- number2 + number0 number1,98.0,"[2, 38, 39, 40, 10, 51, 52, 53, 24, 29, 30, 31]",3,Subtraction,he wanted to make sure that he is protected from the cold evenings in the forest so he decided to build a fireplace made of cement . if he bought number0 lbs of cement and his son brought another number1 lbs,how much cement did he have originally if he now has number2 lbs ?
217, touches number0 gallons paint number1 gallons number2 gallons paint paint,for finishing touches he needed number0 gallons of paint . if he bought number1 gallons to add to his existing number2 gallons of paint how much more paint will he need ?,70 23 36,- - number0 number1 number2,11.0,"[2, 4, 5, 6, 9, 12, 13, 14, 19, 20, 21, 28, 29, 30]",3,TVQ-Change,for finishing touches he needed number0 gallons of paint . if he bought number1 gallons to add to his existing number2 gallons of paint,how much more paint will he need ?
218, rivers farmlands group number0 feet land group number1 feet land number2 feet land,after the cleaning the rivers they went on to tidy up the farmlands . if lizzie 's group covered number0 square feet of land and the other group covered number1 how many more square feet of land remains to be cleaned if there is total of number2 square feet of land ?,250 265 900,- number2 + number0 number1,385.0,"[4, 45, 46, 47, 48, 17, 18, 19, 20, 21, 49, 23, 50, 28, 29, 30]",3,Subtraction,after the cleaning the rivers they went on to tidy up the farmlands . if lizzie 's group covered number0 square feet of land and the other group covered number1,how many more square feet of land remains to be cleaned if there is total of number2 square feet of land ?
219, number0 groups garbage number1 houses city group number2 houses group number3 houses,the number0 groups will also collect garbage from all the number1 houses in the city . if lizzie 's group covered number2 houses while the other group covered number3 how many more houses remain ?,2 453 238 190,- number1 + number2 number3,25.0,"[0, 1, 2, 32, 4, 5, 33, 9, 10, 11, 14, 15, 17, 20, 21, 22, 27, 28, 29, 31]",3,Subtraction,the number0 groups will also collect garbage from all the number1 houses in the city . if lizzie 's group covered number2 houses while the other group covered number3,how many more houses remain ?
220, number0 factories wastes group number1 factories number2 factories,finally they had to roam around number0 factories to make sure they are throwing their wastes properly . if their group went to number1 factories and the second went to number2 how many factories remain unchecked ?,169 69 52,- number0 + number1 number2,48.0,"[33, 34, 35, 4, 5, 6, 7, 14, 16, 22, 23, 24, 29, 30, 31]",3,Subtraction,finally they had to roam around number0 factories to make sure they are throwing their wastes properly . if their group went to number1 factories and the second went to number2,how many factories remain unchecked ?
221, kevin family neighborhood party neighbors party snacks everyone sister number0 mini cupcakes mother number1 grandmother prepare total number2 cupcakes,kevin and his family just moved to a new neighborhood so they are holding a party to be able to meet their new neighbors . for the party they prepared a few snacks for everyone . if his sister prepared number0 mini cupcakes and his mother prepared number1 how many did his grandmother prepare if they have a total of number2 cupcakes ?,25 30 100,- number2 + number0 number1,45.0,"[3, 39, 40, 41, 42, 46, 47, 48, 59, 60, 61]",3,Subtraction,kevin and his family just moved to a new neighborhood so they are holding a party to be able to meet their new neighbors . for the party they prepared a few snacks for everyone . if his sister prepared number0 mini cupcakes and his mother prepared number1,how many did his grandmother prepare if they have a total of number2 cupcakes ?
222, chips number0 grams chips father number1 chips brother prepare number2 grams chips,they also prepared some chips . if he prepared number0 grams of chips and his father prepared number1 grams how much chips should his brother prepare if they are to have number2 grams of chips ?,350 268 800,- number2 + number0 number1,182.0,"[32, 33, 2, 34, 8, 9, 10, 16, 17, 18, 24, 30, 31]",3,Subtraction,they also prepared some chips . if he prepared number0 grams of chips and his father prepared number1 grams,how much chips should his brother prepare if they are to have number2 grams of chips ?
223, party kevin money food drinks utensils number0 number1 food number2 utensils drinks,after the party kevin estimated that the total money they spent on food drinks and utensils sums up to $ number0 . if they spent $ number1 on food and $ number2 on utensils and other stuff how much did they spend on drinks ?,560.00 268.00 118.00,- number0 + number1 number2,174.0,"[32, 2, 41, 42, 43, 19, 20, 25, 26, 27, 30, 31]",3,Subtraction,after the party kevin estimated that the total money they spent on food drinks and utensils sums up to $ number0 . if they spent $ number1 on food and $ number2 on utensils and other stuff,how much did they spend on drinks ?
224, katie birthday trip continent destination island statues number0 miles place plane number1 stopovers number2 stopover number3 miles number4 stopover number5 miles farther island number6 stopover,katie loves to travel . on her birthday she decided to go on a trip on a mysterious continent . her first destination was in an island of statues which is number0 miles from her place . she took a plane that made number1 stopovers the number2 stopover after covering number3 miles and the number4 stopover after another number5 miles . how much farther is the island from the number6 stopover ?,436 2 1 132 2 236 2,- number0 + number3 number5,68.0,"[32, 68, 5, 69, 70, 42, 43, 44, 12, 49, 50, 51, 57, 58, 59, 30, 31]",3,Subtraction,katie loves to travel . on her birthday she decided to go on a trip on a mysterious continent . her first destination was in an island of statues which is number0 miles from her place . she took a plane that made number1 stopovers the number2 stopover after covering number3 miles and the number4 stopover after another number5 miles .,how much farther is the island from the number6 stopover ?
225, number0 stay island number1 food number2 hotel rooms stuff,katie spent a total $ number0 on her whole stay in the island . if she spent $ number1 on food and $ number2 on hotel rooms how much did she spend on buying other stuff ?,350.00 125.00 135.00,- number0 + number1 number2,90.0,"[1, 2, 3, 4, 5, 6, 33, 34, 35, 17, 18, 19, 22, 23, 24]",3,Subtraction,katie spent a total $ number0 on her whole stay in the island . if she spent $ number1 on food and $ number2 on hotel rooms,how much did she spend on buying other stuff ?
226, country mountains number0 species insects reptiles birds number1 species number2 bird species species,next she went to a country full of mountains . there she saw number0 species of insects reptiles and birds . if she saw number1 insect species and number2 bird species how many reptile species did she see ?,532 253 143,- number0 + number1 number2,136.0,"[2, 35, 36, 37, 11, 12, 13, 14, 16, 23, 24, 25, 26, 27, 28, 29, 30]",3,Subtraction,next she went to a country full of mountains . there she saw number0 species of insects reptiles and birds . if she saw number1 insect species and number2 bird species,how many reptile species did she see ?
227, mountain country beach continent number0 seashells colors number1 shells number2 shells shells,after the mountain country she went to the famous beach on the continent . there she collected number0 seashells of different colors . if she has number1 red shells and number2 green shells how many shells are not red or green ?,291 76 49,- number0 + number1 number2,166.0,"[32, 2, 4, 38, 39, 8, 40, 11, 15, 16, 17, 18, 25, 26, 27, 28, 29, 30, 31]",3,Subtraction,after the mountain country she went to the famous beach on the continent . there she collected number0 seashells of different colors . if she has number1 red shells and number2 green shells,how many shells are not red or green ?
228, thanksgiving mary blessing charities number0 number1 nursing homes number2 home number3 home,thanksgiving is coming and dr. mary wants to celebrate it by sharing her blessing to different charities . she first went to oldtown where she donated $ number0 in total to number1 different nursing homes . if she gave $ number2 to the first home and $ number3 to the second how much did she give to the third home ?,700.00 3 245.00 225.00,- number0 + number2 number3,230.0,"[32, 34, 2, 58, 39, 40, 41, 7, 59, 46, 47, 48, 14, 57, 26, 27, 28, 30, 31]",3,Subtraction,thanksgiving is coming and dr. mary wants to celebrate it by sharing her blessing to different charities . she first went to oldtown where she donated $ number0 in total to number1 different nursing homes . if she gave $ number2 to the first home and $ number3 to the second,how much did she give to the third home ?
229, number0 orphanages total number1 number2 orphanage number3 orphanage,she then went to number0 orphanages and donated a total of $ number1 . if she gave $ number2 to the first orphanage and $ number3 to the third how much did she donate to the second orphanage ?,3 650.00 175.00 250.00,- number1 + number2 number3,225.0,"[2, 3, 4, 5, 35, 36, 37, 11, 12, 17, 18, 19, 24, 25, 26]",3,Subtraction,she then went to number0 orphanages and donated a total of $ number1 . if she gave $ number2 to the first orphanage and $ number3 to the third,how much did she donate to the second orphanage ?
230, list homeless people total number0 number1 set families number2 set families set families,next on her list are the homeless people where she spent a total of $ number0 . if she gave $ number1 to the first set of homeless families and $ number2 to the second set of families how much did she give to the last set of homeless families ?,900.00 325.00 260.00,- number0 + number1 number2,315.0,"[32, 2, 14, 15, 47, 48, 49, 20, 21, 22, 30, 31]",3,Subtraction,next on her list are the homeless people where she spent a total of $ number0 . if she gave $ number1 to the first set of homeless families and $ number2 to the second set of families,how much did she give to the last set of homeless families ?
231, number0 number1 soup kitchens town number2 soup kitchen number3,lastly she donated $ number0 to number1 different soup kitchens in her town . if she gave $ number2 to the first soup kitchen and $ number3 to the second how much did she donate to the third ?,800.00 3 300.00 238.00,- number0 + number2 number3,262.0,"[2, 3, 4, 5, 6, 7, 35, 9, 36, 37, 17, 18, 19, 25, 26, 27]",3,Subtraction,lastly she donated $ number0 to number1 different soup kitchens in her town . if she gave $ number2 to the first soup kitchen and $ number3 to the second,how much did she donate to the third ?
232, andrew friends game night snacks games sandwiches number0 friends number1 sandwiches sandwiches,andrew is having his friends over for game night . so he decided to prepare the snacks and the games . he started by making mini sandwiches . if he has number0 friends coming over and he made number1 sandwiches for each one of them how many sandwiches did he make in total ?,4 3,* number0 number1,12.0,"[32, 2, 3, 37, 38, 39, 41, 9, 18, 50, 51, 52, 22, 30, 31]",3,Multiplication,andrew is having his friends over for game night . so he decided to prepare the snacks and the games . he started by making mini sandwiches . if he has number0 friends coming over and he made number1 sandwiches for each one of them,how many sandwiches did he make in total ?
233, juice oranges number0 oranges glass juice number1 glasses juice oranges,he also made some juice from fresh oranges . if he used number0 oranges per glass of juice and he made number1 glasses of juice how many oranges did he use ?,2 6,* number0 number1,12.0,"[2, 6, 11, 12, 13, 14, 17, 20, 21, 22, 28, 29, 30]",3,Multiplication,he also made some juice from fresh oranges . if he used number0 oranges per glass of juice and he made number1 glasses of juice,how many oranges did he use ?
234, expenses game night number0 game total number1 games money night,lastly andrew tried to compute his expenses for the game night . if he spent $ number0 for each game they played and they played a total of number1 games how much money did he spend that night ?,9.00 5,* number0 number1,45.0,"[2, 35, 36, 37, 15, 16, 17, 18, 27, 28, 29]",3,Multiplication,lastly andrew tried to compute his expenses for the game night . if he spent $ number0 for each game they played and they played a total of number1 games,how much money did he spend that night ?
235, mom cookies number0 pans cookies number1 cookies pan cookies mom bake birthday,her mom also baked some cookies . if she baked number0 pans of cookies and there are number1 cookies per pan how many cookies did her mom bake for her birthday ?,5 8,* number0 number1,40.0,"[2, 3, 9, 10, 11, 15, 16, 17, 18, 19, 20, 28, 29, 30]",3,Multiplication,her mom also baked some cookies . if she baked number0 pans of cookies and there are number1 cookies per pan,how many cookies did her mom bake for her birthday ?
236, drinks number0 pitchers drinks pitcher number1 glasses glasses drinks,they planned to serve some cold drinks as well . if they plan to make number0 pitchers of drinks and each pitcher can fill number1 glasses how many glasses of drinks are they planning to prepare in total ?,9 6,* number0 number1,54.0,"[35, 4, 36, 37, 13, 14, 15, 16, 17, 20, 23, 24, 25]",3,Multiplication,they planned to serve some cold drinks as well . if they plan to make number0 pitchers of drinks and each pitcher can fill number1 glasses,how many glasses of drinks are they planning to prepare in total ?
237, party backyard number0 sets tables set number1 chairs chairs guests,they decided to hold the party in their backyard . if they have number0 sets of tables and each set has number1 chairs how many chairs do they have for the guests ?,8 7,* number0 number1,56.0,"[2, 10, 12, 13, 14, 18, 20, 21, 22, 29, 30, 31]",3,Multiplication,they decided to hold the party in their backyard . if they have number0 sets of tables and each set has number1 chairs,how many chairs do they have for the guests ?
238, end party mona souvenirs number0 friends number1 items souvenirs,at the end of the party mona gave away some souvenirs to her number0 closest friends . if each of them received number1 souvenir items how many souvenirs did mona give away ?,6 2,* number0 number1,12.0,"[4, 12, 13, 14, 15, 18, 21, 22, 23, 24, 29, 30, 31]",3,Multiplication,at the end of the party mona gave away some souvenirs to her number0 closest friends . if each of them received number1 souvenir items,how many souvenirs did mona give away ?
239, john tree house hideout whenever time thing materials pillars number0 sets wood lengths set wood number1 feet set number2 times set wood,john is building a tree house to serve as his hideout whenever he wanted to spend some time alone with himself . the first thing he did is to gather some materials . for the pillars he needs number0 sets of wood with different lengths . if the first set of wood is number1 feet long and the second set is number2 times longer than the first set how long is the second set of wood ?,2 4 5,* number1 number2,20.0,"[37, 38, 39, 73, 74, 75, 15, 52, 53, 54, 60, 61, 62]",3,Multiplication,john is building a tree house to serve as his hideout whenever he wanted to spend some time alone with himself . the first thing he did is to gather some materials . for the pillars he needs number0 sets of wood with different lengths . if the first set of wood is number1 feet long and the second set is number2 times longer than the first set,how long is the second set of wood ?
240, material rope number0 feet rope ropes number1 times length rope,another material that he needs is rope . if he already has number0 feet of rope and he needs additional ropes having number1 times the length of what he already have how long should be the additional rope ?,6 5,* number0 number1,30.0,"[3, 35, 36, 37, 11, 12, 13, 21, 22, 23]",3,Multiplication,another material that he needs is rope . if he already has number0 feet of rope and he needs additional ropes having number1 times the length of what he already have,how long should be the additional rope ?
241, walls house number0 planks wood plank wood needs number1 pieces nails john house wall,for the walls of the house he would use number0 large planks of wood . if each plank of wood needs number1 pieces of nails to be secured how many nails does john need for the house wall ?,9 8,* number0 number1,72.0,"[35, 36, 5, 37, 8, 9, 10, 11, 16, 20, 21, 22]",3,Multiplication,for the walls of the house he would use number0 large planks of wood . if each plank of wood needs number1 pieces of nails to be secured,how many nails does john need for the house wall ?
242, roof john number0 sets metal bars support set number1 metal metal bars,for the roof john would need number0 sets of metal bars for support . if each set has number1 metal bars how many metal bars are there in all ?,2 7,* number0 number1,14.0,"[3, 5, 6, 7, 8, 12, 15, 17, 18, 19, 20, 26, 27, 28]",3,Multiplication,for the roof john would need number0 sets of metal bars for support . if each set has number1 metal bars,how many metal bars are there in all ?
243, touches john house number0 colors number1 liters paint color liters paint,for the final touches john wanted to paint the house using the number0 primary colors . if he has number1 liters of paint for each color how many liters of paint does he have in all ?,3 5,* number0 number1,15.0,"[33, 2, 34, 35, 10, 11, 12, 13, 14, 17, 18, 19, 20, 24]",3,Multiplication,for the final touches john wanted to paint the house using the number0 primary colors . if he has number1 liters of paint for each color,how many liters of paint does he have in all ?
244, kids oakwood school bird zoo field trip bird zoo school kids buses number0 buses bus number1 adult supervisors children supervisors total,the kids from oakwood elementary school are visiting a bird zoo for their field trip . to get to the bird zoo from the school the kids have to ride some buses . if there are number0 buses and each bus has number1 adult supervisors to guide the children how many supervisors are there in total ?,7 3,* number0 number1,21.0,"[2, 35, 36, 37, 39, 8, 41, 42, 43, 44, 10, 17, 20, 53, 54, 55, 29]",3,Multiplication,the kids from oakwood elementary school are visiting a bird zoo for their field trip . to get to the bird zoo from the school the kids have to ride some buses . if there are number0 buses and each bus has number1 adult supervisors to guide the children,how many supervisors are there in total ?
245, bus number0 rows seats row seats number1 children children accommodate,if each bus have number0 rows of seats and each row of seats can accommodate number1 children how many children can each bus accommodate ?,9 4,* number0 number1,36.0,"[1, 3, 4, 5, 9, 14, 15, 16, 18, 21, 22, 23]",3,Multiplication,if each bus have number0 rows of seats and each row of seats can accommodate number1 children,how many children can each bus accommodate ?
