,Question,orig_Question,Numbers,Equation,Answer,group_nums,Body,Ques_Statement
1109, pet store number0 puppies day number1 rest cages number2 cage cages,A pet store had number0 puppies . In one day they sold number1 of them and put the rest into cages with number2 in each cage . How many cages did they use ?,64.0 28.0 4.0,/ - number0 number1 number2,9.0,"[3, 4, 5, 11, 12, 13, 21, 22, 23, 30, 31, 32]",A pet store had number0 puppies . In one day they sold number1 of them and put the rest into cages with number2 in each cage .,How many cages did they use ?
1110, Allen Shiela ’ s brother blocks Shiela Allen ’ blocks colors Allen number0 blocks number1 blocks color paint colors Shiela use,"Allen , Shiela ’ s brother , likes to play with blocks . Shiela repainted Allen ’ s old blocks in different colors . If Allen has number0 identical blocks and there are number1 blocks for every color of paint used , how many colors did Shiela use ?",49.0 7.0,/ number0 number1,7.0,"[24, 25, 26, 30, 31, 32, 43, 44, 45]","Allen , Shiela ’ s brother , likes to play with blocks . Shiela repainted Allen ’ s old blocks in different colors . If Allen has number0 identical blocks and there are number1 blocks for every color of paint used ,",how many colors did Shiela use ?
1111, Stephanie number0 hours number1 miles hour Stephanie,If Stephanie ran for number0 hours at number1 miles per hour . How far did Stephanie go ?,3.0 5.0,* number0 number1,15.0,"[3, 4, 5, 6, 7, 8, 14, 15, 16]",If Stephanie ran for number0 hours at number1 miles per hour .,How far did Stephanie go ?
1112, school sale Carol number0 cupcakes number1 number2 cupcakes,"For the school bake sale Carol made number0 cupcakes . If she sold number1 of them and then made number2 more , how many cupcakes would she have ?",30.0 9.0 28.0,- + number0 number2 number1,49.0,"[6, 7, 8, 12, 13, 14, 18, 19, 20, 25, 26, 27]","For the school bake sale Carol made number0 cupcakes . If she sold number1 of them and then made number2 more ,",how many cupcakes would she have ?
1113, Henry collection crayons groups number0 Henry number1 crayons groups,Henry wants to split a collection of crayons into groups of number0 . Henry has number1 crayons . How many groups will be created ?,6.0 42.0,/ number1 number0,7.0,"[10, 11, 12, 14, 15, 16, 21, 22, 23]",Henry wants to split a collection of crayons into groups of number0 . Henry has number1 crayons .,How many groups will be created ?
1114, music online Nancy number0 country albums number1 pop albums album sheet number2 songs songs Nancy,"While shopping for music online , Nancy bought number0 country albums and number1 pop albums . Each album came with a lyric sheet and had number2 songs . How many songs did Nancy buy total ?",3.0 5.0 8.0,* number2 + number0 number1,64.0,"[7, 8, 9, 11, 12, 13, 24, 25, 26, 32, 33, 34]","While shopping for music online , Nancy bought number0 country albums and number1 pop albums . Each album came with a lyric sheet and had number2 songs .",How many songs did Nancy buy total ?
1115, music online Isabel number0 country albums number1 pop albums album sheet number2 songs songs Isabel,"While shopping for music online , Isabel bought number0 country albums and number1 pop albums . Each album came with a lyric sheet and had number2 songs . How many songs did Isabel buy total ?",6.0 2.0 9.0,* number2 + number0 number1,72.0,"[7, 8, 9, 11, 12, 13, 24, 25, 26, 32, 33, 34]","While shopping for music online , Isabel bought number0 country albums and number1 pop albums . Each album came with a lyric sheet and had number2 songs .",How many songs did Isabel buy total ?
1116, Mark number0 miles number1 miles hour Mark sprint,Mark sprinted number0 miles at number1 miles per hour . How long did Mark sprint ?,24.0 6.0,/ number0 number1,4.0,"[1, 2, 3, 4, 5, 6, 12, 13, 14]",Mark sprinted number0 miles at number1 miles per hour .,How long did Mark sprint ?
1117, Joan number0 dimes bank number1 dimes,Joan had number0 dimes in her bank . She spent number1 of her dimes . How many dimes does she have now ?,5.0 2.0,- number0 number1,3.0,"[1, 2, 3, 9, 10, 11, 19, 20, 21]",Joan had number0 dimes in her bank . She spent number1 of her dimes .,How many dimes does she have now ?
1118, music online Megan number0 country albums number1 pop albums album sheet number2 songs songs Megan,"While shopping for music online , Megan bought number0 country albums and number1 pop albums . Each album came with a lyric sheet and had number2 songs . How many songs did Megan buy total ?",2.0 8.0 7.0,* number2 + number0 number1,70.0,"[7, 8, 9, 11, 12, 13, 24, 25, 26, 32, 33, 34]","While shopping for music online , Megan bought number0 country albums and number1 pop albums . Each album came with a lyric sheet and had number2 songs .",How many songs did Megan buy total ?
1119, clown number0 balloons number1 balloons balloons clown,The clown blew up number0 balloons . Then he blew up number1 more balloons . How many balloons does the clown have now ?,47.0 13.0,+ number0 number1,60.0,"[3, 4, 5, 10, 11, 12, 20, 21, 22]",The clown blew up number0 balloons . Then he blew up number1 more balloons .,How many balloons does the clown have now ?
1120, Tom number0 books number1 money number2 books books,"Tom had number0 books . If he sold number1 of them and used the money he earned to buy number2 new books , how many books would Tom have ?",5.0 4.0 38.0,- + number0 number2 number1,39.0,"[1, 2, 3, 7, 8, 9, 18, 19, 20, 26, 27, 28]","Tom had number0 books . If he sold number1 of them and used the money he earned to buy number2 new books ,",how many books would Tom have ?
1121, Benny number0 marbles Keith number1 times marbles Benny marbles Keith,Benny has number0 blue marbles . Keith has number1 times more blue marbles than Benny . How many blue marbles does Keith have ?,6.0 5.0,* number0 number1,30.0,"[1, 2, 3, 7, 8, 9, 20, 21, 22]",Benny has number0 blue marbles . Keith has number1 times more blue marbles than Benny .,How many blue marbles does Keith have ?
1122, oil pipe sea engineers pipe number0 liters oil water engineers pipe number1 liters oil liters oil water,"An oil pipe in the sea broke . Before engineers started to fix the pipe , number0 liters of oil leaked into the water . While the engineers worked , the pipe leaked number1 more liters of oil . In all , how many liters of oil leaked into the water ?",6522.0 5165.0,+ number0 number1,11687.0,"[15, 16, 17, 32, 33, 34, 48, 49, 50]","An oil pipe in the sea broke . Before engineers started to fix the pipe , number0 liters of oil leaked into the water . While the engineers worked , the pipe leaked number1 more liters of oil . In all ,",how many liters of oil leaked into the water ?
1123, number0 Pokemon cards Dan number1 Pokemon cards number2 Pokemon cards Pokemon cards,Sally had number0 Pokemon cards . Dan gave her number1 new Pokemon cards . Sally bought number2 Pokemon cards . How many Pokemon cards does Sally have now ?,27.0 41.0 20.0,+ + number0 number1 number2,88.0,"[1, 2, 3, 8, 9, 10, 15, 16, 17, 25, 26, 27]",Sally had number0 Pokemon cards . Dan gave her number1 new Pokemon cards . Sally bought number2 Pokemon cards .,How many Pokemon cards does Sally have now ?
1124, Ellen smoothies blender number0 cup strawberries number1 cup yogurt number2 cup orange juice cups ingredients Ellen use smoothies,"Ellen made smoothies in the blender . She used number0 cup of strawberries , number1 cup of yogurt , and number2 cup of orange juice . How many cups of ingredients did Ellen use for the smoothies ?",0.2 0.1 0.2,+ + number0 number0 number1,0.5,"[8, 9, 10, 13, 14, 15, 19, 20, 21, 34, 35, 36]","Ellen made smoothies in the blender . She used number0 cup of strawberries , number1 cup of yogurt , and number2 cup of orange juice .",How many cups of ingredients did Ellen use for the smoothies ?
1125, Sarah vegetables garden number0 seeds number1 garden gardens number2 seeds gardens Sarah,Sarah was planting vegetables in her garden . She started with number0 seeds and planted number1 of them in the big garden and in each of her small gardens put number2 seeds each . How many small gardens did Sarah have ?,21.0 12.0 3.0,/ - number0 number1 number2,3.0,"[10, 11, 12, 14, 15, 16, 29, 30, 31, 38, 39, 40]",Sarah was planting vegetables in her garden . She started with number0 seeds and planted number1 of them in the big garden and in each of her small gardens put number2 seeds each .,How many small gardens did Sarah have ?
1126, Katie number0 cupcakes school bake sale brother Todd number1 packages number2 cupcake package,"Katie baked number0 cupcakes for her school 's bake sale . If her brother , Todd , ate number1 of them how many packages could she make if she put number2 cupcake in each package ?",18.0 8.0 2.0,/ - number0 number1 number2,5.0,"[1, 2, 3, 17, 18, 19, 29, 30, 31, 32, 33, 34]","Katie baked number0 cupcakes for her school 's bake sale . If her brother , Todd , ate number1 of them",how many packages could she make if she put number2 cupcake in each package ?
1127, Haley number0 pictures Facebook number1 pics album rest number2 albums pictures album,Haley uploaded number0 pictures to Facebook . She put number1 pics into one album and put the rest into number2 different albums . How many pictures were in each album ?,65.0 17.0 6.0,/ - number0 number1 number2,8.0,"[1, 2, 3, 8, 9, 10, 18, 19, 20, 27, 28, 29]",Haley uploaded number0 pictures to Facebook . She put number1 pics into one album and put the rest into number2 different albums .,How many pictures were in each album ?
1128, Nancy Joan number0 trout trout get,"Nancy goes fishing with Joan . They catch number0 trout . If they equally split up the trout , how many will each one get ?",18.0,/ number0 2.0,9.0,"[7, 8, 9, 24, 25, 26]","Nancy goes fishing with Joan . They catch number0 trout . If they equally split up the trout ,",how many will each one get ?
1129, Mike number0 orange marbles Sam number1 marbles marbles,"Mike has number0 orange marbles , he gave Sam number1 of the marbles . How many orange marbles does he now have ?",8.0 4.0,- number0 number1,4.0,"[1, 2, 3, 8, 9, 10, 19, 20, 21]","Mike has number0 orange marbles , he gave Sam number1 of the marbles .",How many orange marbles does he now have ?
1130, Haley number0 music files number1 video files drive number2 files files flash drive,"Haley had number0 music files and number1 video files on her flash drive . If she deleted number2 of the files , how many files were still on her flash drive ?",27.0 42.0 11.0,- + number0 number1 number2,58.0,"[1, 2, 3, 5, 6, 7, 16, 17, 18, 28, 29, 30]","Haley had number0 music files and number1 video files on her flash drive . If she deleted number2 of the files ,",how many files were still on her flash drive ?
1131, pet store number0 bird cages cage number1 parrots number2 parakeets birds pet store,"A pet store has number0 bird cages . If each cage has number1 parrots and number2 parakeets in it , how many birds does the pet store have total ?",4.0 8.0 2.0,* number0 + number1 number2,40.0,"[3, 4, 5, 11, 12, 13, 14, 15, 16, 26, 27, 28]","A pet store has number0 bird cages . If each cage has number1 parrots and number2 parakeets in it ,",how many birds does the pet store have total ?
1132, total number0 games month season number1 months games seasons,There were a total of number0 hockey games a month . The season is played for number1 months . How many hockey games are in the seasons ?,13.0 14.0,* number0 number1,182.0,"[4, 5, 6, 17, 18, 19, 26, 27, 28]",There were a total of number0 hockey games a month . The season is played for number1 months .,How many hockey games are in the seasons ?
1133, Joan number0 balloons Melanie number1 balloons balloons,Joan has number0 blue balloons Melanie has number1 blue balloons . How many blue balloons do they have in total ?,40.0 41.0,+ number0 number1,81.0,"[1, 2, 3, 6, 7, 8, 17, 18, 19]",Joan has number0 blue balloons Melanie has number1 blue balloons .,How many blue balloons do they have in total ?
1134, Luke cafeteria workers lunch trays number0 trays time number1 trays table number2 trays trips,"Luke was helping the cafeteria workers pick up lunch trays , but he could only carry number0 trays at a time . If he had to pick up number1 trays from one table and number2 trays from another , how many trips will he make ?",4.0 20.0 16.0,/ + number1 number2 number0,9.0,"[15, 16, 17, 27, 28, 29, 33, 34, 35, 42, 43, 44]","Luke was helping the cafeteria workers pick up lunch trays , but he could only carry number0 trays at a time . If he had to pick up number1 trays from one table and number2 trays from another ,",how many trips will he make ?
1135, restaurant number0 slices pie lunch number1 dinner today number2 yesterday slices pie today,A restaurant served number0 slices of pie during lunch and number1 during dinner today . It served number2 of them yesterday . How many slices of pie were served today ?,7.0 5.0 8.0,+ number0 number1,12.0,"[2, 3, 4, 9, 10, 11, 16, 17, 18, 27, 28, 29]",A restaurant served number0 slices of pie during lunch and number1 during dinner today . It served number2 of them yesterday .,How many slices of pie were served today ?
1136, Alyssa cat number0 kittens number1 spots number2 friends kittens,Alyssa 's cat had number0 kittens and number1 had spots . She gave number2 to her friends . How many kittens does she now have ?,8.0 8.0 4.0,- number0 number2,4.0,"[3, 4, 5, 6, 7, 8, 12, 13, 14, 22, 23, 24]",Alyssa 's cat had number0 kittens and number1 had spots . She gave number2 to her friends .,How many kittens does she now have ?
1137, Adam number0 tickets ferris wheel number1 tickets ticket cost number2 dollars money Adam ferris wheel,"At the fair Adam bought number0 tickets . After riding the ferris wheel he had number1 tickets left . If each ticket cost number2 dollars , how much money did Adam spend riding the ferris wheel ?",13.0 4.0 9.0,* number2 - number0 number1,81.0,"[4, 5, 6, 14, 15, 16, 22, 23, 24, 33, 34, 35]","At the fair Adam bought number0 tickets . After riding the ferris wheel he had number1 tickets left . If each ticket cost number2 dollars ,",how much money did Adam spend riding the ferris wheel ?
1138, Christina number0 bank account result account number1 money account transfer,"Christina just transferred $ number0 out of her bank account . As a result , the account now has $ number1 in it . How much money was in the account before the transfer ?",69.0 26935.0,+ number0 number1,27004.0,"[3, 4, 5, 19, 20, 21, 31, 32, 33]","Christina just transferred $ number0 out of her bank account . As a result , the account now has $ number1 in it .",How much money was in the account before the transfer ?
1139, Sarah number0 cupcakes school bake sale brother Todd number1 packages number2 cupcake package,"Sarah baked number0 cupcakes for her school 's bake sale . If her brother , Todd , ate number1 of them how many packages could she make if she put number2 cupcake in each package ?",38.0 14.0 8.0,/ - number0 number1 number2,3.0,"[1, 2, 3, 17, 18, 19, 29, 30, 31, 32, 33, 34]","Sarah baked number0 cupcakes for her school 's bake sale . If her brother , Todd , ate number1 of them",how many packages could she make if she put number2 cupcake in each package ?
1140, building number0 windows builder number1 number2 hours window rest,"A new building needed number0 windows . The builder had already installed number1 of them . If it takes number2 hours to install each window , how long will it take him to install the rest ?",14.0 8.0 8.0,* number1 - number0 number1,48.0,"[3, 4, 5, 11, 12, 13, 18, 19, 20, 33, 34, 35]","A new building needed number0 windows . The builder had already installed number1 of them . If it takes number2 hours to install each window ,",how long will it take him to install the rest ?
1141, number0 students class number1 eggs eggs students student,"There are number0 students in the class and number1 eggs . If the eggs are divided equally among the students , how many does each student get ?",7.0 56.0,/ number1 number0,8.0,"[1, 2, 3, 7, 8, 9, 24, 25, 26]","There are number0 students in the class and number1 eggs . If the eggs are divided equally among the students ,",how many does each student get ?
1142, Marie speed number0 miles hour number1 hours,Marie can bike at a speed of number0 miles an hour . How far can she bike in number1 hours ?,12.0 31.0,* number0 number1,372.0,"[6, 7, 8, 17, 18, 19, 17, 18, 19]",Marie can bike at a speed of number0 miles an hour .,How far can she bike in number1 hours ?
1143, Ernest number0 bananas boxes Julie number1 cookies share Ernest number2 boxes bananas box,"Ernest has number0 bananas that must be put away in boxes . Julie comes to help and brings number1 cookies to share with Ernest . If there are number2 boxes , how many bananas must go in each box ?",45.0 3.0 5.0,/ number0 number2,9.0,"[1, 2, 3, 17, 18, 19, 27, 28, 29, 36, 37, 38]","Ernest has number0 bananas that must be put away in boxes . Julie comes to help and brings number1 cookies to share with Ernest . If there are number2 boxes ,",how many bananas must go in each box ?
1144, chocolate bar box cost number0 box number1 bars Zoe number2 bars money,"Each chocolate bar in a box cost $ number0 . If a box had number1 bars total and Zoe sold all but number2 bars , how much money would she have made ?",6.0 13.0 6.0,* number0 - number1 number0,42.0,"[7, 8, 9, 13, 14, 15, 21, 22, 23, 29, 30, 31]","Each chocolate bar in a box cost $ number0 . If a box had number1 bars total and Zoe sold all but number2 bars ,",how much money would she have made ?
1145, worksheet number0 problems teacher number1 worksheets number2 problems,"A worksheet had number0 problems on it . If a teacher had number1 worksheets to grade and had already graded number2 of them , how many more problems does she have to grade ?",4.0 16.0 8.0,* number0 - number1 number2,32.0,"[2, 3, 4, 11, 12, 13, 19, 20, 21, 30, 31, 32]","A worksheet had number0 problems on it . If a teacher had number1 worksheets to grade and had already graded number2 of them ,",how many more problems does she have to grade ?
1146, Karen number0 boxes Tagalongs cases number1 boxes Karen pickup cookie mom,"If Karen sold number0 boxes of Tagalongs , how many cases of number1 boxes does Karen pickup from the cookie mom ?",36.0 12.0,/ number0 number1,3.0,"[2, 3, 4, 11, 12, 13, 18, 19, 20]","If Karen sold number0 boxes of Tagalongs ,",how many cases of number1 boxes does Karen pickup from the cookie mom ?
1147, Mrs. Sheridan number0 cats Mr. Sheridan number1 cats cats Mrs. Sheridan,Mrs. Sheridan has number0 cats . Mr. Sheridan gave her number1 more cats . How many cats does Mrs. Sheridan have altogether ?,17.0 14.0,+ number0 number1,31.0,"[2, 3, 4, 9, 10, 11, 19, 20, 21]",Mrs. Sheridan has number0 cats . Mr. Sheridan gave her number1 more cats .,How many cats does Mrs. Sheridan have altogether ?
1148, number0 leaves number1 ladybugs leaf ladybugs,There are number0 leaves . There are number1 ladybugs on each leaf . How many ladybugs are there in all ?,84.0 139.0,* number0 number1,11676.0,"[1, 2, 3, 6, 7, 8, 17, 18, 19]",There are number0 leaves . There are number1 ladybugs on each leaf .,How many ladybugs are there in all ?
1149, Adam number0 dollars store number1 game number2 dollars allowance money,"Adam had number0 dollars . At the store he spent $ number1 on a new game . If he got another number2 dollars for his allowance , how much money does he have now ?",5.0 2.0 5.0,- + number0 number0 number1,8.0,"[1, 2, 3, 10, 11, 12, 20, 21, 22, 31, 32, 33]","Adam had number0 dollars . At the store he spent $ number1 on a new game . If he got another number2 dollars for his allowance ,",how much money does he have now ?
1150, Faye mom carrots garden Faye number0 mother number1 number2 carrots carrots,"Faye and her mom were picking carrots from their garden . Faye picked number0 and her mother picked number1 . If only number2 of the carrots were good , how many bad carrots did they have ?",23.0 5.0 12.0,- + number0 number1 number2,16.0,"[12, 13, 14, 17, 18, 19, 21, 22, 23, 33, 34, 35]","Faye and her mom were picking carrots from their garden . Faye picked number0 and her mother picked number1 . If only number2 of the carrots were good ,",how many bad carrots did they have ?
1151, Sara number0 pears number1 apples orchard number2 pears Dan pears Sara,Sara picked number0 pears and number1 apples from the orchard . She gave number2 pears to Dan . How many pears does Sara have ?,35.0 27.0 28.0,- number0 number2,7.0,"[1, 2, 3, 4, 5, 6, 12, 13, 14, 21, 22, 23]",Sara picked number0 pears and number1 apples from the orchard . She gave number2 pears to Dan .,How many pears does Sara have ?
1152, Deborah number0 friends party number1 cookies cookies get,Deborah is inviting number0 friends to a party . She has number1 cookies . How many cookies will each friend get ?,10.0 80.0,/ number1 number0,8.0,"[2, 3, 4, 10, 11, 12, 18, 19, 20]",Deborah is inviting number0 friends to a party . She has number1 cookies .,How many cookies will each friend get ?
1153, Sarah number0 boxes Lemon Chalet Cremes cases number1 boxes boxes Sarah,"Sarah sold number0 boxes of Lemon Chalet Cremes . How many cases of number1 boxes , plus extra boxes does Sarah need ?",24.0 12.0,/ number0 number1,2.0,"[1, 2, 3, 12, 13, 14, 19, 20, 21]",Sarah sold number0 boxes of Lemon Chalet Cremes .,"How many cases of number1 boxes , plus extra boxes does Sarah need ?"
1154, restaurant number0 hamburgers lunch number1 hamburgers lunch,A restaurant made number0 hamburgers to serve during lunch . Only number1 were actually served . How many hamburgers were over from lunch ?,9.0 3.0,- number0 number1,6.0,"[2, 3, 4, 10, 11, 12, 20, 21, 22]",A restaurant made number0 hamburgers to serve during lunch . Only number1 were actually served .,How many hamburgers were over from lunch ?
1155, number0 friends video game online number1 players game player number2 lives lives,"There were number0 friends playing a video game online when number1 more players joined the game . If each player had number2 lives , how many lives did they have total ?",4.0 5.0 3.0,* number2 + number0 number1,27.0,"[1, 2, 3, 9, 10, 11, 20, 21, 22, 28, 29, 30]","There were number0 friends playing a video game online when number1 more players joined the game . If each player had number2 lives ,",how many lives did they have total ?
1156, minute telephone call costs number0 cents minute number1 cents cost number2 minute telephone call,The first minute of a telephone call costs number0 cents and each additional minute number1 cents . What is the cost of a number2 minute telephone call ?,24.0 13.0 5.0,+ number0 * number1 number2,89.0,"[7, 8, 9, 13, 14, 15, 22, 23, 24, 24, 25, 26]",The first minute of a telephone call costs number0 cents and each additional minute number1 cents .,What is the cost of a number2 minute telephone call ?
1157, school sale Katie pastries number0 cupcakes number1 cookies sale number2 home pastries,For the school bake sale Katie made pastries . She baked number0 cupcakes and number1 cookies . After the sale she had number2 to take back home . How many pastries did she sell ?,7.0 5.0 8.0,- + number0 number1 number2,4.0,"[10, 11, 12, 13, 14, 15, 21, 22, 23, 31, 32, 33]",For the school bake sale Katie made pastries . She baked number0 cupcakes and number1 cookies . After the sale she had number2 to take back home .,How many pastries did she sell ?
1158, April discount flowers sale flower number0 dollars Zoe number1 roses number2 daisies,"April 's discount flowers was having a sale where each flower was number0 dollars . If Zoe bought number1 roses and number2 daisies , how much did she spend ?",3.0 8.0 2.0,* number0 + number1 number2,30.0,"[11, 12, 13, 17, 18, 19, 20, 21, 22, 26, 27, 28]","April 's discount flowers was having a sale where each flower was number0 dollars . If Zoe bought number1 roses and number2 daisies ,",how much did she spend ?
1159, Chloe book case shelves number0 books number1 shelves mystery books number2 shelves picture books books,"Chloe was organizing her book case making sure each of the shelves had exactly number0 books on it . If she had number1 shelves of mystery books and number2 shelves of picture books , how many books did she have total ?",6.0 5.0 4.0,* number0 + number1 number2,54.0,"[13, 14, 15, 21, 22, 23, 27, 28, 29, 38, 39, 40]","Chloe was organizing her book case making sure each of the shelves had exactly number0 books on it . If she had number1 shelves of mystery books and number2 shelves of picture books ,",how many books did she have total ?
1160, part lesson earthquakes science class movement fault line fault line number0 inches year number1 inches year fault line move,"As part of a lesson on earthquakes , a science class is researching the movement of a nearby fault line . The fault line moved number0 inches during the past year and number1 inches the year before . How far did the fault line move in all ?",1.25 5.25,+ number0 number1,6.5,"[24, 25, 26, 31, 32, 33, 44, 45, 46]","As part of a lesson on earthquakes , a science class is researching the movement of a nearby fault line . The fault line moved number0 inches during the past year and number1 inches the year before .",How far did the fault line move in all ?
1161, Amy video game number0 points treasure number1 treasures level number2 score,"Amy was playing a video game where she scores number0 points for each treasure she finds . If she found number1 treasures on the first level and number2 on the second , what would her score be ?",4.0 6.0 2.0,* number0 + number1 number2,32.0,"[8, 9, 10, 19, 20, 21, 26, 27, 28, 34, 35, 36]","Amy was playing a video game where she scores number0 points for each treasure she finds . If she found number1 treasures on the first level and number2 on the second ,",what would her score be ?
