,Question,orig_Question,Numbers,Equation,Answer,group_nums,Body,Ques_Statement
771, hardware store number0 nails size number1 nails size fraction nails size,"At the hardware store , number0 the nails are size 2d and number1 the nails are size 4d . What fraction of the nails are either size 2d or 4d ?",0.25 0.5,+ number0 number1,0.75,"[4, 5, 6, 11, 12, 13, 27, 28, 29]","At the hardware store , number0 the nails are size 2d and number1 the nails are size 4d .",What fraction of the nails are either size 2d or 4d ?
772, banana number0 number1 cost,Each banana costs $ number0 . How much do number1 bananas cost ?,5.0 4.0,* number0 number1,20.0,"[3, 4, 5, 8, 9, 10, 9, 10, 11]",Each banana costs $ number0 .,How much do number1 bananas cost ?
773, Chloe winter clothes number0 boxes clothing box number1 scarves number2 mittens pieces winter clothing Chloe total,Chloe was unboxing some of her old winter clothes . She found number0 boxes of clothing and inside each box there were number1 scarves and number2 mittens . How many pieces of winter clothing did Chloe have total ?,4.0 2.0 6.0,* number0 + number1 number2,32.0,"[11, 12, 13, 21, 22, 23, 24, 25, 26, 35, 36, 37]",Chloe was unboxing some of her old winter clothes . She found number0 boxes of clothing and inside each box there were number1 scarves and number2 mittens .,How many pieces of winter clothing did Chloe have total ?
774, Virginia number0 eggs Amy number1 eggs Virginia,Virginia starts with number0 eggs . Amy takes number1 away . How many eggs does Virginia end with ?,96.0 3.0,- number0 number1,93.0,"[2, 3, 4, 7, 8, 9, 15, 16, 17]",Virginia starts with number0 eggs . Amy takes number1 away .,How many eggs does Virginia end with ?
775, John number0 number1 money,John needs $ number0 . He has $ number1 . How much more money does he need ?,2.5 0.75,- number0 number1,1.75,"[2, 3, 4, 7, 8, 9, 14, 15, 16]",John needs $ number0 . He has $ number1 .,How much more money does he need ?
776, Dan number0 potatoes number1 cantelopes garden rabbits number2 potatoes potatoes Dan,Dan had number0 potatoes and number1 cantelopes in the garden . The rabbits ate number2 of the potatoes . How many potatoes does Dan now have ?,7.0 4.0 4.0,- number0 number1,3.0,"[1, 2, 3, 4, 5, 6, 13, 14, 15, 23, 24, 25]",Dan had number0 potatoes and number1 cantelopes in the garden . The rabbits ate number2 of the potatoes .,How many potatoes does Dan now have ?
777, Kevin number0 watermelons watermelon number1 pounds watermelon number2 pounds pounds watermelon Kevin,"Kevin bought number0 watermelons . The first watermelon was number1 pounds , and the second watermelon was number2 pounds . How many pounds of watermelon did Kevin buy ?",2.0 9.91 4.11,+ number1 number2,14.02,"[1, 2, 3, 8, 9, 10, 16, 17, 18, 25, 26, 27]","Kevin bought number0 watermelons . The first watermelon was number1 pounds , and the second watermelon was number2 pounds .",How many pounds of watermelon did Kevin buy ?
778, Isabel number0 pictures phone number1 camera pics number2 albums amount pics album pictures albums,"Isabel uploaded number0 pictures from her phone and number1 from her camera to facebook . If she sorted the pics into number2 different albums with the same amount of pics in each album , how many pictures were in each of the albums ?",2.0 4.0 3.0,/ + number0 number1 number2,2.0,"[1, 2, 3, 7, 8, 9, 20, 21, 22, 40, 41, 42]","Isabel uploaded number0 pictures from her phone and number1 from her camera to facebook . If she sorted the pics into number2 different albums with the same amount of pics in each album ,",how many pictures were in each of the albums ?
779, Ashley number0 boxes Samoas cases number1 boxes boxes Ashley,"Ashley sold number0 boxes of Samoas . How many cases of number1 boxes , plus extra boxes does Ashley need ?",12.0 12.0,/ number0 number0,1.0,"[1, 2, 3, 10, 11, 12, 17, 18, 19]",Ashley sold number0 boxes of Samoas .,"How many cases of number1 boxes , plus extra boxes does Ashley need ?"
780, number0 bushes park Park workers plant number1 bushes today bushes park workers,There are number0 rose bushes currently in the park . Park workers will plant number1 more rose bushes today . How many rose bushes will the park have when the workers are finished ?,2.0 4.0,+ number0 number1,6.0,"[1, 2, 3, 13, 14, 15, 30, 31, 32]",There are number0 rose bushes currently in the park . Park workers will plant number1 more rose bushes today .,How many rose bushes will the park have when the workers are finished ?
781, Haley mom carrots garden Haley number0 mother number1 number2 carrots carrots,"Haley and her mom were picking carrots from their garden . Haley picked number0 and her mother picked number1 . If only number2 of the carrots were good , how many bad carrots did they have ?",39.0 38.0 64.0,- + number0 number1 number2,13.0,"[12, 13, 14, 17, 18, 19, 21, 22, 23, 33, 34, 35]","Haley and her mom were picking carrots from their garden . Haley picked number0 and her mother picked number1 . If only number2 of the carrots were good ,",how many bad carrots did they have ?
782, Sara number0 quarters number1 dimes bank sister number2 dimes Sara,Sara had number0 quarters and number1 dimes in her bank . Her sister borrowed number2 dimes . How many dimes does Sara have now ?,4.0 8.0 4.0,- number1 number0,4.0,"[1, 2, 3, 4, 5, 6, 13, 14, 15, 21, 22, 23]",Sara had number0 quarters and number1 dimes in her bank . Her sister borrowed number2 dimes .,How many dimes does Sara have now ?
783, Victor number0 Skittles number1 people class left overs Skittles classmate get,"If Victor split number0 Skittles between number1 people in her class and kept the left overs , how many Skittles did each classmate get ?",25.0 5.0,/ number0 number1,5.0,"[2, 3, 4, 5, 6, 7, 21, 22, 23]","If Victor split number0 Skittles between number1 people in her class and kept the left overs ,",how many Skittles did each classmate get ?
784, Mary number0 oranges Jason number1 oranges Keith number2 apples oranges,Mary picked number0 oranges and Jason picked number1 oranges . Keith picked number2 apples . How many oranges were picked in all ?,14.0 41.0 38.0,+ number0 number1,55.0,"[1, 2, 3, 6, 7, 8, 11, 12, 13, 19, 20, 21]",Mary picked number0 oranges and Jason picked number1 oranges . Keith picked number2 apples .,How many oranges were picked in all ?
785, Kaleb number0 dollars number1 bucks game number2 dollar toys money,"Kaleb had number0 dollars . If he spent number1 bucks on a new game , how many number2 dollar toys could he buy with the money he had left ?",12.0 8.0 2.0,/ - number0 number1 number2,2.0,"[1, 2, 3, 7, 8, 9, 16, 17, 18, 26, 27, 28]","Kaleb had number0 dollars . If he spent number1 bucks on a new game ,",how many number2 dollar toys could he buy with the money he had left ?
786, number0 children bus zoo number1 children seat seats children,number0 children are taking a bus to the zoo . They sit number1 children in every seat . How many seats will the children need in all ?,58.0 2.0,/ number0 number1,29.0,"[0, 1, 11, 12, 13, 24, 25, 26]",number0 children are taking a bus to the zoo . They sit number1 children in every seat .,How many seats will the children need in all ?
787, Sara number0 quarters bank dad number1 quarters quarters,Sara had number0 quarters in her bank . Her dad gave her number1 more quarters . How many quarters does she have now ?,21.0 49.0,+ number0 number1,70.0,"[1, 2, 3, 11, 12, 13, 20, 21, 22]",Sara had number0 quarters in her bank . Her dad gave her number1 more quarters .,How many quarters does she have now ?
788, number0 dogwood trees park Park workers plant number1 trees today number2 trees tomorrow dogwood trees park workers,There are number0 dogwood trees currently in the park . Park workers will plant number1 more dogwood trees today and number2 more dogwood trees tomorrow . How many dogwood trees will the park have when the workers are finished ?,39.0 41.0 20.0,+ + number0 number1 number2,100.0,"[1, 2, 3, 15, 16, 17, 21, 22, 23, 38, 39, 40]",There are number0 dogwood trees currently in the park . Park workers will plant number1 more dogwood trees today and number2 more dogwood trees tomorrow .,How many dogwood trees will the park have when the workers are finished ?
789, Stanley number0 number1 mile Stanley walk,Stanley ran number0 mile and walked number1 mile . How much farther did Stanley run than walk ?,0.4 0.2,- number0 number1,0.2,"[1, 2, 3, 5, 6, 7, 14, 15, 16]",Stanley ran number0 mile and walked number1 mile .,How much farther did Stanley run than walk ?
790, Shawn number0 blocks Mildred number1 blocks Mildred number2 blocks Mildred,Shawn has number0 blocks . Mildred has with number1 blocks . Mildred finds another number2 . How many blocks does Mildred end with ?,13.0 2.0 84.0,+ number1 number2,86.0,"[1, 2, 3, 7, 8, 9, 13, 14, 15, 20, 21, 22]",Shawn has number0 blocks . Mildred has with number1 blocks . Mildred finds another number2 .,How many blocks does Mildred end with ?
791, Melanie number0 plums Dan number1 plums Sally number2 plums plum tree plums,"Melanie picked number0 plums , Dan picked number1 plums , and Sally picked number2 plums from the plum tree . How many plums were picked in total ?",4.0 9.0 3.0,+ + number0 number1 number2,16.0,"[1, 2, 3, 6, 7, 8, 12, 13, 14, 24, 25, 26]","Melanie picked number0 plums , Dan picked number1 plums , and Sally picked number2 plums from the plum tree .",How many plums were picked in total ?
792, Jessica number0 quarters bank sister number1 quarters quarters Jessica,Jessica had number0 quarters in her bank . Her sister borrowed number1 of her quarters . How many quarters does Jessica have now ?,8.0 3.0,- number0 number1,5.0,"[1, 2, 3, 10, 11, 12, 20, 21, 22]",Jessica had number0 quarters in her bank . Her sister borrowed number1 of her quarters .,How many quarters does Jessica have now ?
793, Amanda number0 hours Kimberly house number1 miles hour Amanda house Kimberly house,It took Amanda number0 hours to stroll to Kimberly 's house at number1 miles per hour . How far is it between Amanda 's house and Kimberly 's house ?,3.0 2.0,* number0 number1,6.0,"[2, 3, 4, 11, 12, 13, 26, 27, 28]",It took Amanda number0 hours to stroll to Kimberly 's house at number1 miles per hour .,How far is it between Amanda 's house and Kimberly 's house ?
794, Mrs. Hilt number0 cents pencil number1 cents money,Mrs. Hilt had number0 cents . She bought a pencil for number1 cents . How much money did she have left ?,15.0 11.0,- number0 number1,4.0,"[2, 3, 4, 10, 11, 12, 18, 19, 20]",Mrs. Hilt had number0 cents . She bought a pencil for number1 cents .,How much money did she have left ?
795, music online Isabel number0 country albums number1 pop albums album sheet number2 songs songs Isabel,"While shopping for music online , Isabel bought number0 country albums and number1 pop albums . Each album came with a lyric sheet and had number2 songs . How many songs did Isabel buy total ?",4.0 5.0 8.0,* number2 + number0 number1,72.0,"[7, 8, 9, 11, 12, 13, 24, 25, 26, 32, 33, 34]","While shopping for music online , Isabel bought number0 country albums and number1 pop albums . Each album came with a lyric sheet and had number2 songs .",How many songs did Isabel buy total ?
796, chef number0 kilograms almonds number1 kilograms pecans kilograms nuts chef buy,A chef bought number0 kilograms of almonds and number1 kilograms of pecans . How many kilograms of nuts did the chef buy in all ?,0.14 0.38,+ number0 number1,0.52,"[2, 3, 4, 7, 8, 9, 21, 22, 23]",A chef bought number0 kilograms of almonds and number1 kilograms of pecans .,How many kilograms of nuts did the chef buy in all ?
797, Helen number0 cards Gary number1 cards Helen,Helen starts with number0 cards . Gary takes number1 away . How many cards does Helen end with ?,82.0 9.0,- number0 number1,73.0,"[2, 3, 4, 7, 8, 9, 15, 16, 17]",Helen starts with number0 cards . Gary takes number1 away .,How many cards does Helen end with ?
798, Olivia baggies cookies number0 cookies bag number1 chocolate chip cookies number2 oatmeal cookies baggies,"Olivia was making baggies of cookies with number0 cookies in each bag . If she had number1 chocolate chip cookies and number2 oatmeal cookies , how many baggies could she make ?",9.0 13.0 41.0,/ + number1 number2 number0,6.0,"[6, 7, 8, 15, 16, 17, 20, 21, 22, 28, 29, 30]","Olivia was making baggies of cookies with number0 cookies in each bag . If she had number1 chocolate chip cookies and number2 oatmeal cookies ,",how many baggies could she make ?
799, Bob number0 feet rope number1 hours Tim number2 feet rope number3 hours feet rope Bob Tim number4 hours,"If Bob can make number0 feet of rope in number1 hours and Tim can make number2 feet of rope in number3 hours , how many feet of rope can Bob and Tim working together make in number4 hours ?",100.0 2.0 75.0 2.0 4.0,+ * / number0 number1 number4 * / number2 number1 number4,350.0,"[3, 4, 5, 8, 9, 10, 14, 15, 16, 19, 20, 21, 35, 36, 37, 35, 36, 37]","If Bob can make number0 feet of rope in number1 hours and Tim can make number2 feet of rope in number3 hours ,",how many feet of rope can Bob and Tim working together make in number4 hours ?
800, Bianca number0 carrots garden number1 number2 day carrots,"Bianca picked number0 carrots from her garden . If she threw out number1 of them and then picked number2 more the next day , how many carrots would she have total ?",23.0 10.0 47.0,- + number0 number2 number1,60.0,"[1, 2, 3, 11, 12, 13, 17, 18, 19, 28, 29, 30]","Bianca picked number0 carrots from her garden . If she threw out number1 of them and then picked number2 more the next day ,",how many carrots would she have total ?
801, Nancy washing machine number0 pieces clothing time number1 shirts number2 sweaters loads,Nancy 's old washing machine could only wash number0 pieces of clothing at a time . If she had to wash number1 shirts and number2 sweaters how many loads would she have to do ?,9.0 19.0 8.0,/ + number1 number2 number0,3.0,"[7, 8, 9, 20, 21, 22, 23, 24, 25, 31, 32, 33]",Nancy 's old washing machine could only wash number0 pieces of clothing at a time . If she had to wash number1 shirts and number2 sweaters,how many loads would she have to do ?
802, Joan number0 books Tom number1 books books,Joan has number0 books . Tom has number1 books . How many books do they have together ?,10.0 38.0,+ number0 number1,48.0,"[1, 2, 3, 6, 7, 8, 16, 17, 18]",Joan has number0 books . Tom has number1 books .,How many books do they have together ?
803, Tom number0 boxes chocolate candy number1 brother box number2 pieces pieces Tom,"Tom bought number0 boxes of chocolate candy and gave number1 to his little brother . If each box has number2 pieces inside it , how many pieces did Tom still have ?",14.0 8.0 3.0,* number2 - number0 number1,18.0,"[1, 2, 3, 8, 9, 10, 18, 19, 20, 28, 29, 30]","Tom bought number0 boxes of chocolate candy and gave number1 to his little brother . If each box has number2 pieces inside it ,",how many pieces did Tom still have ?
804, Misha number0 dollars dollars number1 dollars,Misha has number0 dollars . How many more dollars does she have to earn to have number1 dollars ?,34.0 47.0,- number1 number0,13.0,"[1, 2, 3, 15, 16, 17, 15, 16, 17]",Misha has number0 dollars .,How many more dollars does she have to earn to have number1 dollars ?
805, Edward lawn mowing business spring number0 dollars lawns summer number1 dollars number2 dollars supplies money,"Edward started his own lawn mowing business . In the spring he made number0 dollars mowing lawns and in the summer he made number1 dollars . If he had to spend number2 dollars buying supplies , how much money did he end up with ?",2.0 27.0 5.0,- + number0 number1 number2,24.0,"[12, 13, 14, 22, 23, 24, 30, 31, 32, 41, 42, 43]","Edward started his own lawn mowing business . In the spring he made number0 dollars mowing lawns and in the summer he made number1 dollars . If he had to spend number2 dollars buying supplies ,",how much money did he end up with ?
806, Fred number0 baseball cards Melanie number1 Fred baseball cards baseball cards Fred,Fred has number0 baseball cards . Melanie bought number1 of Fred 's baseball cards . How many baseball cards does Fred have now ?,5.0 3.0,- number0 number1,2.0,"[1, 2, 3, 7, 8, 9, 20, 21, 22]",Fred has number0 baseball cards . Melanie bought number1 of Fred 's baseball cards .,How many baseball cards does Fred have now ?
807, Kenji classmates blocks scale science lab block number0 pounds block number1 pounds yellow block weigh block,Kenji and his classmates placed colored blocks on a scale during a science lab . The yellow block weighed number0 pounds and the green block weighed number1 pounds . How much more did the yellow block weigh than the green block ?,0.6 0.4,- number0 number1,0.2,"[18, 19, 20, 25, 26, 27, 38, 39, 40]",Kenji and his classmates placed colored blocks on a scale during a science lab . The yellow block weighed number0 pounds and the green block weighed number1 pounds .,How much more did the yellow block weigh than the green block ?
808, Joan number0 seashells beach Sam seashells number1 seashells Sam,Joan found number0 seashells on the beach . she gave Sam some of her seashells . She has number1 seashell . How many seashells did she give to Sam ?,70.0 27.0,- number0 number1,43.0,"[1, 2, 3, 17, 18, 19, 26, 27, 28]",Joan found number0 seashells on the beach . she gave Sam some of her seashells . She has number1 seashell .,How many seashells did she give to Sam ?
809, Isabel number0 pages math homework number1 pages homework page number2 problems problems total,"Isabel had number0 pages of math homework and number1 pages of reading homework . If each page had number2 problems on it , how many problems did she have to complete total ?",2.0 4.0 5.0,* number2 + number0 number1,30.0,"[1, 2, 3, 7, 8, 9, 17, 18, 19, 29, 30, 31]","Isabel had number0 pages of math homework and number1 pages of reading homework . If each page had number2 problems on it ,",how many problems did she have to complete total ?
810, Olivia mom carrots garden Olivia number0 mother number1 number2 carrots carrots,"Olivia and her mom were picking carrots from their garden . Olivia picked number0 and her mother picked number1 . If only number2 of the carrots were good , how many bad carrots did they have ?",20.0 14.0 19.0,- + number0 number1 number2,15.0,"[12, 13, 14, 17, 18, 19, 21, 22, 23, 33, 34, 35]","Olivia and her mom were picking carrots from their garden . Olivia picked number0 and her mother picked number1 . If only number2 of the carrots were good ,",how many bad carrots did they have ?
811, number0 erasers drawer number1 erasers desk Alyssa number2 erasers number3 rulers desk erasers total,There are number0 erasers in the drawer and number1 erasers on the desk . Alyssa placed number2 erasers and number3 rulers on the desk . How many erasers are now there in total ?,48.0 30.0 39.0 45.0,+ + number0 number1 number2,117.0,"[1, 2, 3, 4, 7, 8, 9, 10]",There are number0 erasers in the drawer and number1 erasers on the desk . Alyssa placed number2 erasers and number3 rulers on the desk .,How many erasers are now there in total ?
812, bowl number0 chips number1 chips number2 chips number3 chip random probability chip,"A bowl contains number0 red chips , number1 blue chips , and number2 green chips . You choose number3 chip at random . What is the probability that your chip is not red ?",4.0 3.0 9.0 1.0,/ + number1 number2 + + number0 number1 number2,0.75,"[2, 3, 4, 6, 7, 8, 11, 12, 13, 17, 18, 19, 30, 31, 32]","A bowl contains number0 red chips , number1 blue chips , and number2 green chips . You choose number3 chip at random .",What is the probability that your chip is not red ?
813, Keith number0 pears Jason number1 pears tree Joan number2 apples apple tree pears,Keith picked number0 pears and Jason picked number1 pears from the pear tree . Joan picked number2 apples from the apple tree . How many pears were picked in total ?,3.0 2.0 5.0,+ number0 number1,5.0,"[1, 2, 3, 6, 7, 8, 15, 16, 17, 27, 28, 29]",Keith picked number0 pears and Jason picked number1 pears from the pear tree . Joan picked number2 apples from the apple tree .,How many pears were picked in total ?
814, Maria baggies cookies number0 cookies bag number1 chocolate chip cookies number2 oatmeal cookies baggies,"Maria was making baggies of cookies with number0 cookies in each bag . If she had number1 chocolate chip cookies and number2 oatmeal cookies , how many baggies could she make ?",5.0 33.0 2.0,/ + number1 number2 number0,7.0,"[6, 7, 8, 15, 16, 17, 20, 21, 22, 28, 29, 30]","Maria was making baggies of cookies with number0 cookies in each bag . If she had number1 chocolate chip cookies and number2 oatmeal cookies ,",how many baggies could she make ?
815, number0 pencils number1 pencils pencil box pencil boxes,"I have number0 pencils . If I put number1 pencils in each pencil box , how many pencil boxes will I fill ?",648.0 4.0,/ number0 number1,162.0,"[1, 2, 3, 7, 8, 9, 19, 20, 21]","I have number0 pencils . If I put number1 pencils in each pencil box ,",how many pencil boxes will I fill ?
816, Joan number0 balloons number1 balloons Joan,Joan has number0 orange balloons but lost number1 of them . How many orange balloons does Joan have now ?,8.0 2.0,- number0 number1,6.0,"[1, 2, 3, 6, 7, 8, 16, 17, 18]",Joan has number0 orange balloons but lost number1 of them .,How many orange balloons does Joan have now ?
817, Ralph number0 cards Ralph father Ralph number1 cards Ralph,Ralph collects number0 cards . Ralph 's father gives Ralph number1 more . How many cards does Ralph have ?,4.0 8.0,+ number0 number1,12.0,"[1, 2, 3, 9, 10, 11, 16, 17, 18]",Ralph collects number0 cards . Ralph 's father gives Ralph number1 more .,How many cards does Ralph have ?
818, Professor Ellison number0 pieces metal experiment piece iron number1 pounds piece aluminum number2 pound piece iron weigh piece aluminum,Professor Ellison weighed number0 pieces of metal for an experiment . The piece of iron weighed number1 pounds and the piece of aluminum weighed number2 pound . How much more did the piece of iron weigh than the piece of aluminum ?,2.0 11.166666666666666 0.8333333333333334,- number1 number2,10.333333333333334,"[2, 3, 4, 15, 16, 17, 23, 24, 25, 38, 39, 40]",Professor Ellison weighed number0 pieces of metal for an experiment . The piece of iron weighed number1 pounds and the piece of aluminum weighed number2 pound .,How much more did the piece of iron weigh than the piece of aluminum ?
819, Sandy dog number0 puppies number1 spots number2 friends puppies,Sandy 's dog had number0 puppies and number1 had spots . She gave number2 to her friends . How many puppies does she now have ?,8.0 4.0 4.0,- number0 number1,4.0,"[3, 4, 5, 6, 7, 8, 12, 13, 14, 22, 23, 24]",Sandy 's dog had number0 puppies and number1 had spots . She gave number2 to her friends .,How many puppies does she now have ?
820, number0 scissors number1 pencils drawer Jason number2 scissors drawer scissors total,There are number0 scissors and number1 pencils in the drawer . Jason placed number2 scissors in the drawer . How many scissors are now there in total ?,5.0 3.0 4.0,+ number0 number2,9.0,"[1, 2, 3, 4, 5, 6, 12, 13, 14, 24, 25, 26]",There are number0 scissors and number1 pencils in the drawer . Jason placed number2 scissors in the drawer .,How many scissors are now there in total ?
821, number0 books library shelves number1 books shelves library,There are number0 books in a library . They are arranged on shelves that hold number1 books each . How many shelves are in the library ?,14240.0 8.0,/ number0 number1,1780.0,"[1, 2, 3, 14, 15, 16, 23, 24, 25]",There are number0 books in a library . They are arranged on shelves that hold number1 books each .,How many shelves are in the library ?
822, pet store number0 bird cages cage number1 parrots number2 parakeets birds pet store,"A pet store has number0 bird cages . If each cage has number1 parrots and number2 parakeets in it , how many birds does the pet store have total ?",9.0 2.0 2.0,* number0 + number1 number1,36.0,"[3, 4, 5, 11, 12, 13, 14, 15, 16, 26, 27, 28]","A pet store has number0 bird cages . If each cage has number1 parrots and number2 parakeets in it ,",how many birds does the pet store have total ?
823, Dan number0 violet marbles Mary number1 marbles violet marbles,"Dan has number0 violet marbles , he gave Mary number1 of the marbles . How many violet marbles does he now have ?",64.0 14.0,- number0 number1,50.0,"[1, 2, 3, 8, 9, 10, 19, 20, 21]","Dan has number0 violet marbles , he gave Mary number1 of the marbles .",How many violet marbles does he now have ?
824, Bonnie number0 tickets shares number1 friends tickets friend get,"Bonnie has number0 tickets . If she shares them among number1 friends , how many tickets does each friend get ?",10.0 2.0,/ number0 number1,5.0,"[1, 2, 3, 9, 10, 11, 17, 18, 19]","Bonnie has number0 tickets . If she shares them among number1 friends ,",how many tickets does each friend get ?
825, Willie number0 stickers number1 Emily stickers Willie,Willie starts with number0 stickers . He gives number1 to Emily . How many stickers does Willie end with ?,36.0 7.0,- number0 number1,29.0,"[2, 3, 4, 7, 8, 9, 16, 17, 18]",Willie starts with number0 stickers . He gives number1 to Emily .,How many stickers does Willie end with ?
826, Carl number0 hours Ralph house number1 miles hour Carl house Ralph house,It took Carl number0 hours to ride to Ralph 's house at number1 miles per hour . How far is it between Carl 's house and Ralph 's house ?,5.0 2.0,* number0 number1,10.0,"[2, 3, 4, 11, 12, 13, 26, 27, 28]",It took Carl number0 hours to ride to Ralph 's house at number1 miles per hour .,How far is it between Carl 's house and Ralph 's house ?
