,Question,orig_Question,Numbers,Equation,Answer,group_nums,Body,Ques_Statement
387, class pizza party number0 pizza number1 pizza box pizza,"Your class had a pizza party . number0 of a pizza was left over , and number1 of another pizza was left over . You put them both into one box . How much pizza do you have altogether ?",0.375 0.5,+ number0 number1,0.875,"[6, 7, 8, 15, 16, 17, 38, 39, 40]","Your class had a pizza party . number0 of a pizza was left over , and number1 of another pizza was left over . You put them both into one box .",How much pizza do you have altogether ?
388, eggs hen number0 baskets number1 basket eggs,Emily collected eggs from the hen and put them into number0 baskets . She put number1 eggs into each basket . How many eggs did Emily collect ?,303.0 28.0,* number0 number1,8484.0,"[9, 10, 11, 14, 15, 16, 24, 25, 26]",Emily collected eggs from the hen and put them into number0 baskets . She put number1 eggs into each basket .,How many eggs did Emily collect ?
389, Sandy number0 carrots number1 turnips Mary number2 carrots carrots,Sandy grew number0 carrots and number1 turnips . Mary grew number2 carrots . How many carrots did they grow in all ?,8.0 7.0 6.0,+ number0 number2,14.0,"[1, 2, 3, 4, 5, 6, 9, 10, 11, 18, 19, 20]",Sandy grew number0 carrots and number1 turnips . Mary grew number2 carrots .,How many carrots did they grow in all ?
390, Timothy house number0 miles Emily house Timothy house Emily number1 hours,Emily sprinted to Timothy 's house . It is number0 miles from Emily 's house to Timothy 's house . It took Emily number1 hours to get there . How fast did Emily go ?,10.0 2.0,/ number0 number1,5.0,"[8, 9, 10, 22, 23, 24, 31, 32, 33]",Emily sprinted to Timothy 's house . It is number0 miles from Emily 's house to Timothy 's house . It took Emily number1 hours to get there .,How fast did Emily go ?
391, Tiffany number0 brownies number1 total party number2 cups flour cups flour,"Tiffany baked number0 brownies , but needed number1 total for her party . If she used number2 cups of flour on each one , how much cups of flour does she still need ?",8.0 17.0 8.0,* number0 - number1 number0,72.0,"[1, 2, 3, 6, 7, 8, 15, 16, 17, 30, 31, 32]","Tiffany baked number0 brownies , but needed number1 total for her party . If she used number2 cups of flour on each one ,",how much cups of flour does she still need ?
392, Lana band concert tickets number0 dollars Lana number1 tickets herself friends number2 tickets case anyone,Lana 's favorite band was holding a concert where tickets were number0 dollars each . Lana bought number1 tickets for herself and her friends and number2 extra tickets in case anyone else wanted to go . How much did she spend ?,6.0 8.0 2.0,* number0 + number1 number2,60.0,"[10, 11, 12, 16, 17, 18, 24, 25, 26, 38, 39, 40]",Lana 's favorite band was holding a concert where tickets were number0 dollars each . Lana bought number1 tickets for herself and her friends and number2 extra tickets in case anyone else wanted to go .,How much did she spend ?
393, Rachel books number0 pictures number1 week number2 pictures pictures,Rachel bought two coloring books . One had number0 pictures and the other had number1 . After one week she had already colored number2 of the pictures . How many pictures does she still have to color ?,23.0 32.0 44.0,- + number0 number1 number2,11.0,"[7, 8, 9, 13, 14, 15, 22, 23, 24, 34, 35, 36]",Rachel bought two coloring books . One had number0 pictures and the other had number1 . After one week she had already colored number2 of the pictures .,How many pictures does she still have to color ?
394, March number0 inches number1 inches April March April,In March it rained number0 inches . It rained number1 inches less in April than in March . How much did it rain in April ?,0.81 0.35,- number0 number1,0.46,"[3, 4, 5, 8, 9, 10, 22, 23, 24]",In March it rained number0 inches . It rained number1 inches less in April than in March .,How much did it rain in April ?
395, Benny lunch Sara Tom person orders number0 lunch Benny bill,Benny goes out to lunch with Sara and Tom . Each person orders the $ number0 lunch special . Benny agrees to pay the bill . How much will he have to pay ?,8.0,* 3.0 number0,24.0,"[14, 15, 16, 30, 31, 32]",Benny goes out to lunch with Sara and Tom . Each person orders the $ number0 lunch special . Benny agrees to pay the bill .,How much will he have to pay ?
396, Oliver books number0 book number1 Oliver rest number2 books shelf shelves,"Oliver is at the library helping put away books . There are number0 book to put away total but a librarian takes number1 of them and leaves Oliver with the rest . If he can fit number2 books on a shelf , how many shelves will he need ?",46.0 10.0 4.0,/ - number0 number1 number2,9.0,"[11, 12, 13, 21, 22, 23, 35, 36, 37, 45, 46, 47]","Oliver is at the library helping put away books . There are number0 book to put away total but a librarian takes number1 of them and leaves Oliver with the rest . If he can fit number2 books on a shelf ,",how many shelves will he need ?
397, Sean number0 whistles number1 whistles Charles whistles Charles,Sean has number0 whistles . He has number1 more whistles that Charles . How many whistles does Charles have ?,223.0 95.0,- number0 number1,128.0,"[1, 2, 3, 6, 7, 8, 16, 17, 18]",Sean has number0 whistles . He has number1 more whistles that Charles .,How many whistles does Charles have ?
398, Larry number0 cards Dennis number1 cards,Larry has number0 cards . Dennis takes number1 away . How many cards will Larry have ?,67.0 9.0,- number0 number1,58.0,"[1, 2, 3, 6, 7, 8, 13, 14, 15]",Larry has number0 cards . Dennis takes number1 away .,How many cards will Larry have ?
399, number0 erasers box Jane number1 erasers bag Doris number2 erasers box erasers box,There are number0 erasers in a box . Jane has number1 erasers in a bag . Doris takes number2 erasers out of the box . How many erasers are left in the box ?,69.0 15.0 54.0,- number0 number2,15.0,"[1, 2, 3, 9, 10, 11, 17, 18, 19, 30, 31, 32]",There are number0 erasers in a box . Jane has number1 erasers in a bag . Doris takes number2 erasers out of the box .,How many erasers are left in the box ?
400, candy store number0 boxes chocolates box number1 pieces pieces boxes,A candy store has number0 boxes of chocolates . Each box has number1 pieces . How many pieces are there altogether in the boxes ?,6.0 500.0,* number0 number1,3000.0,"[3, 4, 5, 11, 12, 13, 21, 22, 23]",A candy store has number0 boxes of chocolates . Each box has number1 pieces .,How many pieces are there altogether in the boxes ?
401, number0 students number1 stars school wall stars,There are number0 students making number1 stars each for the school wall . How many stars will they make all together ?,124.0 3.0,* number0 number1,372.0,"[1, 2, 3, 4, 5, 6, 18, 19, 20]",There are number0 students making number1 stars each for the school wall .,How many stars will they make all together ?
402, Mrs. Hilt pies weekend holiday dinner number0 pies number1 apples pies pies rows number2 pies rows,"Mrs. Hilt baked pies last weekend for a holiday dinner . She baked number0 pecan pies and number1 apples pies . If she wants to arrange all of the pies in rows of number2 pies each , how many rows will she have ?",16.0 14.0 5.0,+ number0 number1,30.0,"[12, 13, 14, 16, 17, 18, 34, 35, 36, 42, 43, 44]","Mrs. Hilt baked pies last weekend for a holiday dinner . She baked number0 pecan pies and number1 apples pies . If she wants to arrange all of the pies in rows of number2 pies each ,",how many rows will she have ?
403, number0 walnut trees park Park workers plant number1 walnut trees today walnut trees park workers,There are number0 walnut trees currently in the park . Park workers will plant number1 walnut trees today . How many walnut trees will the park have when the workers are finished ?,33.0 44.0,+ number0 number1,77.0,"[1, 2, 3, 13, 14, 15, 29, 30, 31]",There are number0 walnut trees currently in the park . Park workers will plant number1 walnut trees today .,How many walnut trees will the park have when the workers are finished ?
404, number0 people zoo number1 cars people zoo car number car,number0 people are going to the zoo . There are number1 cars to take people to the zoo . How many will go in each car if the same number go in each car ?,63.0 3.0,/ number0 number1,21.0,"[0, 1, 9, 10, 11, 31, 32, 33]",number0 people are going to the zoo . There are number1 cars to take people to the zoo .,How many will go in each car if the same number go in each car ?
405, toy store number0 stuffed bears stock shipment number1 bears bears shelves number2 shelf shelves,A toy store had number0 giant stuffed bears in stock when they got another shipment with number1 bears in it . The put the bears onto shelves with number2 on each shelf . How many shelves did they use ?,17.0 10.0 9.0,/ + number0 number1 number2,3.0,"[3, 4, 5, 15, 16, 17, 27, 28, 29, 36, 37, 38]",A toy store had number0 giant stuffed bears in stock when they got another shipment with number1 bears in it . The put the bears onto shelves with number2 on each shelf .,How many shelves did they use ?
406, Rachel video game number0 points treasure number1 treasures level number2 score,"Rachel was playing a video game where she scores number0 points for each treasure she finds . If she found number1 treasures on the first level and number2 on the second , what would her score be ?",9.0 5.0 2.0,* number0 + number1 number2,63.0,"[8, 9, 10, 19, 20, 21, 26, 27, 28, 34, 35, 36]","Rachel was playing a video game where she scores number0 points for each treasure she finds . If she found number1 treasures on the first level and number2 on the second ,",what would her score be ?
407, Denise number0 bananas jar number1 bananas jar bananas jar,Denise removes number0 bananas from a jar . There were originally number1 bananas in the jar . How many bananas are left in the jar ?,5.0 46.0,- number1 number0,41.0,"[1, 2, 3, 10, 11, 12, 22, 23, 24]",Denise removes number0 bananas from a jar . There were originally number1 bananas in the jar .,How many bananas are left in the jar ?
408, Mrs. Hilt border garden number0 rocks border number1 rocks rocks border,Mrs. Hilt wants to make a border around her garden . She needs number0 rocks to complete the border . She has number1 rocks . How many more rocks does she need to complete the border ?,125.0 64.0,- number0 number1,61.0,"[12, 13, 14, 21, 22, 23, 35, 36, 37]",Mrs. Hilt wants to make a border around her garden . She needs number0 rocks to complete the border . She has number1 rocks .,How many more rocks does she need to complete the border ?
409, Wendy number0 flowers friend ’ s wedding bouquets number1 flowers number2 flowers wedding bouquets,"Wendy picked number0 flowers for her friend ’ s wedding . She was making bouquets with number1 flowers in each one . If number2 of the flowers wilted before the wedding , how many bouquets could she still make ?",45.0 5.0 35.0,/ - number0 number2 number1,2.0,"[1, 2, 3, 14, 15, 16, 21, 22, 23, 35, 36, 37]","Wendy picked number0 flowers for her friend ’ s wedding . She was making bouquets with number1 flowers in each one . If number2 of the flowers wilted before the wedding ,",how many bouquets could she still make ?
410, company number0 people luncheon number1 tables number2 people tables,"A company invited number0 people to a luncheon , but number1 of them did n't show up . If the tables they had held number2 people each , how many tables do they need ?",45.0 35.0 2.0,/ - number0 number1 number2,5.0,"[2, 3, 4, 9, 10, 11, 23, 24, 25, 31, 32, 33]","A company invited number0 people to a luncheon , but number1 of them did n't show up . If the tables they had held number2 people each ,",how many tables do they need ?
411, birthday party George number0 sodas number1 sodas fridge number2 shelf shelves,"For a birthday party George bought number0 regular sodas and number1 diet sodas . If his fridge would only hold number2 on each shelf , how many shelves would he fill up ?",10.0 22.0 4.0,/ + number0 number1 number2,8.0,"[5, 6, 7, 9, 10, 11, 19, 20, 21, 29, 30, 31]","For a birthday party George bought number0 regular sodas and number1 diet sodas . If his fridge would only hold number2 on each shelf ,",how many shelves would he fill up ?
412, Carol number0 peanuts Carol father Carol number1 peanuts Carol,Carol collects number0 peanuts . Carol 's father gives Carol number1 more . How many peanuts does Carol have ?,2.0 5.0,+ number0 number1,7.0,"[1, 2, 3, 9, 10, 11, 16, 17, 18]",Carol collects number0 peanuts . Carol 's father gives Carol number1 more .,How many peanuts does Carol have ?
413, Halloween Debby sister candy Debby number0 pieces candy sister number1 number2 pieces night pieces,"For Halloween Debby and her sister combined the candy they received . Debby had number0 pieces of candy while her sister had number1 . If they ate number2 pieces the first night , how many pieces do they have left ?",32.0 42.0 35.0,- + number0 number1 number2,39.0,"[13, 14, 15, 21, 22, 23, 26, 27, 28, 37, 38, 39]","For Halloween Debby and her sister combined the candy they received . Debby had number0 pieces of candy while her sister had number1 . If they ate number2 pieces the first night ,",how many pieces do they have left ?
414, Ruth number0 apples shares number1 Peter apples Ruth,Ruth starts with number0 apples . She shares number1 with Peter . How many apples does Ruth end with ?,89.0 5.0,- number0 number1,84.0,"[2, 3, 4, 7, 8, 9, 16, 17, 18]",Ruth starts with number0 apples . She shares number1 with Peter .,How many apples does Ruth end with ?
415, Benny number0 seashells number1 starfish beach number2 seashells Jason seashells Benny,Benny found number0 seashells and number1 starfish on the beach . He gave number2 of the seashells to Jason . How many seashells does Benny now have ?,66.0 49.0 52.0,- number0 number2,14.0,"[1, 2, 3, 4, 5, 6, 12, 13, 14, 24, 25, 26]",Benny found number0 seashells and number1 starfish on the beach . He gave number2 of the seashells to Jason .,How many seashells does Benny now have ?
416, Jorge number0 goals soccer season season number1 goals number goals Jorge,Jorge scored number0 goals playing soccer last season . This season he scored number1 goals . What is the total number of goals Jorge scored ?,156.0 187.0,+ number0 number1,343.0,"[1, 2, 3, 12, 13, 14, 22, 23, 24]",Jorge scored number0 goals playing soccer last season . This season he scored number1 goals .,What is the total number of goals Jorge scored ?
417, Anne number0 pounds Douglas number1 pounds Anne Douglas,Anne weighs number0 pounds . Douglas weighs number1 pounds . How much heavier is Anne than Douglas ?,67.0 52.0,- number0 number1,15.0,"[1, 2, 3, 6, 7, 8, 14, 15, 16]",Anne weighs number0 pounds . Douglas weighs number1 pounds .,How much heavier is Anne than Douglas ?
418, arcade Cody number0 tickets number1 tickets beanie number2 tickets,"At the arcade Cody won number0 tickets . If he spent number1 tickets on a beanie and later won number2 more tickets , how many would he have ?",49.0 25.0 6.0,- + number0 number2 number1,30.0,"[4, 5, 6, 10, 11, 12, 18, 19, 20, 25, 26, 27]","At the arcade Cody won number0 tickets . If he spent number1 tickets on a beanie and later won number2 more tickets ,",how many would he have ?
419, Benny number0 hours number1 days hours,Benny worked number0 hours for number1 days . How many hours did he work in total ?,3.0 6.0,* number0 number1,18.0,"[1, 2, 3, 4, 5, 6, 13, 14, 15]",Benny worked number0 hours for number1 days .,How many hours did he work in total ?
420, number0 friends video game online number1 players player number2 lives lives,"There were number0 friends playing a video game online when number1 players quit . If each player left had number2 lives , how many lives did they have total ?",13.0 8.0 6.0,* number2 - number0 number1,30.0,"[1, 2, 3, 9, 10, 11, 18, 19, 20, 26, 27, 28]","There were number0 friends playing a video game online when number1 players quit . If each player left had number2 lives ,",how many lives did they have total ?
421, Sarah trucks number0 Jeff number1 trucks trucks Sarah,"Sarah had some trucks . She gave number0 to Jeff , and now she has number1 trucks left . How many trucks did Sarah have to start with ?",13.0 38.0,+ number0 number1,51.0,"[6, 7, 8, 14, 15, 16, 25, 26, 27]","Sarah had some trucks . She gave number0 to Jeff , and now she has number1 trucks left .",How many trucks did Sarah have to start with ?
422, Adam number0 books number1 money number2 books books,"Adam had number0 books . If he sold number1 of them and used the money he earned to buy number2 new books , how many books would Adam have ?",33.0 11.0 23.0,- + number0 number2 number1,45.0,"[1, 2, 3, 7, 8, 9, 18, 19, 20, 26, 27, 28]","Adam had number0 books . If he sold number1 of them and used the money he earned to buy number2 new books ,",how many books would Adam have ?
423, Ron number0 metal balls science class ball number1 pounds ball number2 pounds Ron balls scale time scale read,"Ron weighed number0 colored metal balls during a science class . The blue ball weighed number1 pounds and the brown ball weighed number2 pounds . If Ron places both balls on the scale at the same time , what will the scale read ?",2.0 6.0 3.12,+ number1 number2,9.12,"[1, 2, 3, 14, 15, 16, 21, 22, 23, 40, 41, 42]","Ron weighed number0 colored metal balls during a science class . The blue ball weighed number1 pounds and the brown ball weighed number2 pounds . If Ron places both balls on the scale at the same time ,",what will the scale read ?
424, Lexie ’ s younger brother paper clips Lexie ’ s room number0 paper clips paper clips number1 boxes paper clips box contain,"Lexie ’ s younger brother helped pick up all the paper clips in Lexie ’ s room . He was able to collect number0 paper clips . If he wants to distribute the paper clips in number1 boxes , how many paper clips will each box contain ?",81.0 9.0,/ number0 number1,9.0,"[20, 21, 22, 33, 34, 35, 42, 43, 44]","Lexie ’ s younger brother helped pick up all the paper clips in Lexie ’ s room . He was able to collect number0 paper clips . If he wants to distribute the paper clips in number1 boxes ,",how many paper clips will each box contain ?
425, Paco Countertop Company pieces marble quarry weights pieces number0 ton number1 ton number2 ton tons marble Paco Countertop Company purchase,"Paco 's Countertop Company purchased pieces of marble from a quarry . The weights of the pieces they purchased were number0 ton , number1 ton , and number2 ton . How many tons of marble did Paco 's Countertop Company purchase in all ?",0.3333333333333333 0.3333333333333333 0.08333333333333333,+ + number0 number0 number2,0.75,"[19, 20, 21, 22, 23, 24, 26, 27, 28, 40, 41, 42]","Paco 's Countertop Company purchased pieces of marble from a quarry . The weights of the pieces they purchased were number0 ton , number1 ton , and number2 ton .",How many tons of marble did Paco 's Countertop Company purchase in all ?
426, Pamela number0 ounces sugar number1 ounces floor,"Pamela bought number0 ounces of sugar , and she spilled number1 ounces of it on the floor . How much is ?",9.8 5.2,- number0 number1,4.6,"[1, 2, 3, 9, 10, 11, 18, 19, 20]","Pamela bought number0 ounces of sugar , and she spilled number1 ounces of it on the floor .",How much is ?
427, Dan number0 violet marbles Mary number1 marbles violet marbles,"Dan has number0 violet marbles , he gave Mary number1 of the marbles . How many violet marbles does he now have ?",64.0 14.0,- number0 number1,50.0,"[1, 2, 3, 8, 9, 10, 19, 20, 21]","Dan has number0 violet marbles , he gave Mary number1 of the marbles .",How many violet marbles does he now have ?
428, number0 slide number1 slide boys slide,number0 boys went down the slide . number1 more boys went down the slide . How many boys went down the slide ?,22.0 13.0,+ number0 number1,35.0,"[0, 1, 6, 7, 8, 19, 20, 21]",number0 boys went down the slide . number1 more boys went down the slide .,How many boys went down the slide ?
429, Brennan number0 grams pepper number1 grams pepper eggs pepper Brennan,Brennan had number0 grams of pepper . Then he used number1 grams of the pepper to make some scrambled eggs . How much pepper does Brennan have ?,0.25 0.16,- number0 number1,0.09,"[1, 2, 3, 9, 10, 11, 24, 25, 26]",Brennan had number0 grams of pepper . Then he used number1 grams of the pepper to make some scrambled eggs .,How much pepper does Brennan have ?
430, Robin baggies cookies number0 cookies bag number1 chocolate chip cookies number2 oatmeal cookies baggies,"Robin was making baggies of cookies with number0 cookies in each bag . If she had number1 chocolate chip cookies and number2 oatmeal cookies , how many baggies could she make ?",6.0 23.0 25.0,/ + number1 number2 number0,8.0,"[6, 7, 8, 15, 16, 17, 20, 21, 22, 28, 29, 30]","Robin was making baggies of cookies with number0 cookies in each bag . If she had number1 chocolate chip cookies and number2 oatmeal cookies ,",how many baggies could she make ?
431, video game Paul number0 points cousin total number1 points points Paul cousin,"While playing a video game , Paul scored number0 points . He and his cousin together have a total of number1 points . How many points does Paul 's cousin have ?",3103.0 5816.0,- number1 number0,2713.0,"[7, 8, 9, 19, 20, 21, 28, 29, 30]","While playing a video game , Paul scored number0 points . He and his cousin together have a total of number1 points .",How many points does Paul 's cousin have ?
432, number0 books Oak Grove library addition number1 books school libraries books libraries Oak Grove,"There are number0 books in Oak Grove 's public library . In addition , there are number1 books in its school libraries . How many books do the libraries in Oak Grove have overall ?",1986.0 5106.0,+ number0 number1,7092.0,"[1, 2, 3, 15, 16, 17, 31, 32, 33]","There are number0 books in Oak Grove 's public library . In addition , there are number1 books in its school libraries .",How many books do the libraries in Oak Grove have overall ?
433, waiter number0 tables number1 women number2 men table customers waiter,"A waiter had number0 tables he was waiting on , with number1 women and number2 men at each table . How many customers total did the waiter have ?",7.0 7.0 2.0,* number0 + number0 number2,63.0,"[2, 3, 4, 10, 11, 12, 13, 14, 15, 25, 26, 27]","A waiter had number0 tables he was waiting on , with number1 women and number2 men at each table .",How many customers total did the waiter have ?
434, Jane apple number0 pays number1 bill change,Jane buys an apple for $ number0 and pays with a $ number1 bill . How much change will she get ?,0.75 5.0,- number1 number0,4.25,"[5, 6, 7, 11, 12, 13, 18, 19, 20]",Jane buys an apple for $ number0 and pays with a $ number1 bill .,How much change will she get ?
435, number0 birds tree number1 birds tree birds tree,number0 birds were sitting in a tree . number1 more birds flew up to the tree . How many birds were there altogether in the tree ?,179.0 38.0,+ number0 number1,217.0,"[0, 1, 7, 8, 9, 23, 24, 25]",number0 birds were sitting in a tree . number1 more birds flew up to the tree .,How many birds were there altogether in the tree ?
436, school sale Katie number0 cupcakes number1 number2 cupcakes,"For the school bake sale Katie made number0 cupcakes . If she sold number1 of them and then made number2 more , how many cupcakes would she have ?",26.0 20.0 20.0,- + number0 number1 number1,26.0,"[6, 7, 8, 12, 13, 14, 18, 19, 20, 25, 26, 27]","For the school bake sale Katie made number0 cupcakes . If she sold number1 of them and then made number2 more ,",how many cupcakes would she have ?
437, Kaleb games number0 number1 rest number2 games box boxes,Kaleb was selling his old games . He started out with number0 but sold number1 of them . He packed the rest up putting number2 games into each box . How many boxes did he have to use ?,76.0 46.0 5.0,/ - number0 number1 number2,6.0,"[10, 11, 12, 13, 14, 15, 23, 24, 25, 35, 36, 37]",Kaleb was selling his old games . He started out with number0 but sold number1 of them . He packed the rest up putting number2 games into each box .,How many boxes did he have to use ?
438, Nancy number0 dollars bills money,Nancy has number0 five dollars bills . How much money does she have ?,9.0,* number0 5.0,45.0,"[1, 2, 3, 12, 13, 14]",Nancy has number0 five dollars bills .,How much money does she have ?
439, Sara number0 pumpkins rabbits number1 pumpkins pumpkins Sara,"Sara grew number0 pumpkins , but the rabbits ate number1 pumpkins . How many pumpkins does Sara have ?",43.0 23.0,- number0 number1,20.0,"[1, 2, 3, 8, 9, 10, 15, 16, 17]","Sara grew number0 pumpkins , but the rabbits ate number1 pumpkins .",How many pumpkins does Sara have ?
440, Marcia number0 minutes science project hours Marcia spend science project,Marcia spent number0 minutes working on her science project . How many hours did Marcia spend on her science project ?,300.0,/ number0 60.0,5.0,"[1, 2, 3, 17, 18, 19]",Marcia spent number0 minutes working on her science project .,How many hours did Marcia spend on her science project ?
441, number0 walnut trees park Park workers plant number1 trees today walnut trees park workers,There are number0 walnut trees currently in the park . Park workers will plant number1 more walnut trees today . How many walnut trees will the park have when the workers are finished ?,107.0 104.0,+ number0 number1,211.0,"[1, 2, 3, 15, 16, 17, 32, 33, 34]",There are number0 walnut trees currently in the park . Park workers will plant number1 more walnut trees today .,How many walnut trees will the park have when the workers are finished ?
